"internal_id","text","verse_short_title","probability","V1","date","book_title","scripture_text"
11824,"we heard the lecture on the sacrament read by professor figure i signed to day as","1 Ne. 1:12",0.252630346,321,1894-01-01,"1 Nephi","And it came to pass that as he read, he was filled with the Spirit of the Lord."
11844,"the forenoon i and my family were served wi a warrent on an irigation ditch i","2 Ne. 5:6",0.252603618,301,1893-07-01,"2 Nephi","Wherefore, it came to pass that I, Nephi, did take my family, and also Zoram and his family, and Sam, mine elder brother and his family, and Jacob and Joseph, my younger brethren, and also my sisters, and all those who would go with me. And all those who would go with me were those who believed in the warnings and the revelations of God; wherefore, they did hearken unto my words."
11835,"we had a hard snow storm at night we met wi mr the great banker and","Alma 56:23",0.252271179,310,1897-03-01,"Alma","For we knew in those cities they were not sufficiently strong to meet them; therefore we were desirous, if they should pass by us, to fall upon them in their rear, and thus bring them up in the rear at the same time they were met in the front. We supposed that we could overpower them; but behold, we were disappointed in this our desire."
11807,"meeting of the ogden power company i also attended a surgucal operation at mchenrys of dr","D&C 123:14",0.25217373,338,1897-03-01,"Doctrine and Covenants","These should then be attended to with great earnestness."
11792,"attended the first day of conference amp spoke in the forenoon amp the teaching was all","D&C 29:10",0.251973094,353,1893-09-01,"Doctrine and Covenants","For the hour is nigh, and that which was spoken by mine apostles must be fulfilled; for as they spoke so shall it come to pass;"
11833,"amp family untill then took cars amp returned home to farmers ward miles i had conversation","D&C 19:36",0.251675592,312,1893-07-01,"Doctrine and Covenants","Leave thy house and home, except when thou shalt desire to see thy family;"
11799,"journey figures i wrote a letter in from to that pages of manuscript made pages in","D&C 5:30",0.251615193,346,1896-08-01,"Doctrine and Covenants","And if this be the case, behold, I say unto thee Joseph, when thou hast translated a few more pages thou shalt stop for a season, even until I command thee again; then thou mayest translate again."
11815,"done there before the finish i spent the day in the office i spent the day","D&C 138:25",0.251433465,330,1893-02-01,"Doctrine and Covenants","I marveled, for I understood that the Savior spent about three years in his ministry among the Jews and those of the house of Israel, endeavoring to teach them the everlasting gospel and call them unto repentance;"
11829,"the and took cars for had a very interesting journey of miles a vast amount of","Omni 1:29",0.251387858,316,1896-08-01,"Omni","And it came to pass that they also took others to a considerable number, and took their journey again into the wilderness."
11824,"took supper this meeting was in honor of brother cannon bir day he being years of","D&C 58:9",0.251242993,321,1894-01-01,"Doctrine and Covenants","Yea, a supper of the house of the Lord, well prepared, unto which all nations shall be invited."
11816,"i spent the day in the office was quite unwell we had a long talk wi","Hel. 13:25",0.251047606,329,1789-03-01,"Helaman","And now when ye talk, ye say: If our days had been in the days of our fathers of old, we would not have slain the prophets; we would not have stoned them, and cast them out."
11839,"of the business of the year they sold during the year cts received cash during the","D&C 138:36",0.250980079,306,1893-03-01,"Doctrine and Covenants","Thus was it made known that our Redeemer spent his time during his sojourn in the world of spirits, instructing and preparing the faithful spirits of the prophets who had testified of him in the flesh;"
11819,"am growing quite weak i met the twelve in the i was quite sick i was","D&C 45:52",0.250925725,326,1896-05-01,"Doctrine and Covenants","Then shall they know that I am the Lord; for I will say unto them: These wounds are the wounds with which I was wounded in the house of my friends. I am he who was lifted up. I am Jesus that was crucified. I am the Son of God."
11801,"a bank meeting i spent the forenoon in the office the afternoon in the and had","Alma 3:3",0.250750145,344,1894-01-01,"Alma","And now as many of the Lamanites and the Amlicites who had been slain upon the bank of the river Sidon were cast into the waters of Sidon; and behold their bones are in the depths of the sea, and they are many."
11837,"the garden was the most interesting we saw ten century plants in bloom i seem to","Hel. 7:10",0.25053726,308,1896-08-01,"Helaman","And behold, now it came to pass that it was upon a tower, which was in the garden of Nephi, which was by the highway which led to the chief market, which was in the city of Zarahemla; therefore, Nephi had bowed himself upon the tower which was in his garden, which tower was also near unto the garden gate by which led the highway."
11806,"cash yearly interest on money expect to net in if they get tons of beets i","Moro. 9:14",0.250173191,339,1893-01-01,"Moroni","How can we expect that God will stay his hand in judgment against us?"
11785,"day at home resting figure i wrote a letter to in answer to his amp one","Omni 1:9",0.249493855,360,1895-12-01,"Omni","Now I, Chemish, write what few things I write, in the same book with my brother; for behold, I saw the last which he wrote, that he wrote it with his own hand; and he wrote it in the day that he delivered them unto me. And after this manner we keep the records, for it is according to the commandments of our fathers. And I make an end."
11834,"wi others we voted to build a rail road to i met this morning wi upon","Alma 56:41",0.249385469,311,1894-01-01,"Alma","And it came to pass that again, when the light of the morning came we saw the Lamanites upon us, and we did flee before them."
11843,"council i i spent the day in the office had a good deal of company an","D&C 107:86",0.24936816,302,1894-01-01,"Doctrine and Covenants","And also the duty of the president over the office of the teachers is to preside over twenty-four of the teachers, and to sit in council with them, teaching them the duties of their office, as given in the covenants."
11845,"beef amp bread amp drank a cup of coffee dr called amp felt much encouraged bro","2 Ne. 8:22",0.249090461,300,1897-04-01,"2 Nephi","Thus saith thy Lord, the Lord and thy God pleadeth the cause of his people; behold, I have taken out of thine hand the cup of trembling, the dregs of the cup of my fury; thou shalt no more drink it again."
11792,"had a good time returned to the office met the board of savings bank untill oclok","Mosiah 25:6",0.248924451,353,1893-09-01,"Mosiah","And he also read the account of Alma and his brethren, and all their afflictions, from the time they left the land of Zarahemla until the time they returned again."
11801,"the money he had collected for the county amp city amounting to we have strugeled several","D&C 20:81",0.248767577,344,1894-01-01,"Doctrine and Covenants","It shall be the duty of the several churches, composing the church of Christ, to send one or more of their teachers to attend the several conferences held by the elders of the church,"
11808,"i went to the at noon i received a letter from president upon the business of","1 Ne. 1:9",0.248603886,337,1896-05-01,"1 Nephi","And it came to pass that he saw One descending out of the midst of heaven, and he beheld that his luster was above that of the sun at noon-day."
11775,"me amp took amp her dhters up to i went to the office amp met wi","Alma 19:29",0.248578491,370,1896-07-01,"Alma","And it came to pass that she went and took the queen by the hand, that perhaps she might raise her from the ground; and as soon as she touched her hand she arose and stood upon her feet, and cried with a loud voice, saying: O blessed Jesus, who has saved me from an awful hell! O blessed God, have mercy on this people!"
11807,"better but soon went home i was visited by madam she gave me a history of","Alma 19:29",0.248287545,338,1897-03-01,"Alma","And it came to pass that she went and took the queen by the hand, that perhaps she might raise her from the ground; and as soon as she touched her hand she arose and stood upon her feet, and cried with a loud voice, saying: O blessed Jesus, who has saved me from an awful hell! O blessed God, have mercy on this people!"
11828,"the spring i spent the day in the house reading i was sick but i went","D&C 84:68",0.247828951,317,1893-03-01,"Doctrine and Covenants","In my name they shall heal the sick;"
11777,"a number of the brethrn figures i got a letter from saying was worse dangerous wi","Alma 44:21",0.247735217,368,1896-04-01,"Alma","Now the number of their dead was not numbered because of the greatness of the number; yea, the number of their dead was exceedingly great, both on the Nephites and on the Lamanites."
11840,"received a letter from we had a vary busy day had several meetings amp much company","D&C 20:44",0.247624883,305,1896-01-01,"Doctrine and Covenants","And to take the lead of all meetings."
11768,"i went fishing cht trout total trout while camped on fish creek we drove to excallante","3 Ne. 14:10",0.247533518,377,1887-07-01,"3 Nephi","Or if he ask a fish, will he give him a serpent?"
11790,"of continuing the rr to on the of when i lay at the point of dea","Alma 37:44",0.24710531,355,1893-05-01,"Alma","For behold, it is as easy to give heed to the word of Christ, which will point to you a straight course to eternal bliss, as it was for our fathers to give heed to this compass, which would point unto them a straight course to the promised land."
11807,"of herself i spent the day at home writing amp reading i met some people in","D&C 76:100",0.247020258,338,1897-03-01,"Doctrine and Covenants","These are they who say they are some of one and some of another--some of Christ and some of John, and some of Moses, and some of Elias, and some of Esaias, and some of Isaiah, and some of Enoch;"
11775,"us it seems as though ruin was uppon us unless we raised some money","D&C 76:18",0.246942459,370,1896-07-01,"Doctrine and Covenants","Now this caused us to marvel, for it was given unto us of the Spirit."
11777,"one from president about owen release we held a meeting wi the twelve in the we","D&C 10:19",0.24681609,368,1896-04-01,"Doctrine and Covenants","Therefore we will destroy him, and also the work; and we will do this that we may not be ashamed in the end, and that we may get glory of the world."
11796,"met wi the presidency amp twelve in the i administered to sick person i wrote letters","D&C 94:3",0.246760141,349,1893-02-01,"Doctrine and Covenants","And let the first lot on the south be consecrated unto me for the building of a house for the presidency, for the work of the presidency, in obtaining revelations; and for the work of the ministry of the presidency, in all things pertaining to the church and kingdom."
11827,"spent the day at home and in the evening i went on board of a private","Alma 34:21",0.246635754,318,1893-10-01,"Alma","Cry unto him in your houses, yea, over all your household, both morning, mid-day, and evening."
11807,"met at the amp talked upon a variety of subjects patriarchareal order of riage judge called","D&C 107:3",0.246633942,338,1897-03-01,"Doctrine and Covenants","Before his day it was called the Holy Priesthood, after the Order of the Son of God."
11771,"during the night i met wi the brethren on the power company to day amp talked","Hel. 14:4",0.246552525,374,1897-02-01,"Helaman","Therefore, there shall be one day and a night and a day, as if it were one day and there were no night; and this shall be unto you for a sign; for ye shall know of the rising of the sun and also of its setting; therefore they shall know of a surety that there shall be two days and a night; nevertheless the night shall not be darkened; and it shall be the night before he is born."
11827,"account of the bill giving us back our money was recevied we had quite a number","Alma 58:10",0.246534939,318,1893-10-01,"Alma","Therefore we did pour out our souls in prayer to God, that he would strengthen us and deliver us out of the hands of our enemies, yea, and also give us strength that we might retain our cities, and our lands, and our possessions, for the support of our people."
11812,"provided the proper transportation for the party so that we got along all right i had","D&C 101:63",0.246528561,333,1896-08-01,"Doctrine and Covenants","Again, verily I say unto you, I will show unto you wisdom in me concerning all the churches, inasmuch as they are willing to be guided in a right and proper way for their salvation--"
11775,"at sea figures i received a letter from i wrote her one yesterday unless god opens","Alma 54:15",0.246333571,370,1896-07-01,"Alma","Now it came to pass that Ammoron, when he had received this epistle, was angry; and he wrote another epistle unto Moroni, and these are the words which he wrote, saying:"
11790,"and was breathing my last no one thought i would live thousands of the saints were","Alma 23:5",0.245990013,355,1893-05-01,"Alma","And thousands were brought to the knowledge of the Lord, yea, thousands were brought to believe in the traditions of the Nephites; and they were taught the records and prophecies which were handed down even to the present time."
11846,"the most romantic country i ever saw a great deal of the way was through tunnels","Mosiah 4:7",0.245869749,299,1896-08-01,"Mosiah","I say, that this is the man who receiveth salvation, through the atonement which was prepared from the foundation of the world for all mankind, which ever were since the fall of Adam, or who are, or who ever shall be, even unto the end of the world."
11794,"washington if we are defeated mormons are responsible cannon wired amp called him home a l","D&C 121:40",0.245791337,351,1893-02-01,"Doctrine and Covenants","Hence many are called, but few are chosen."
11800,"parties sects amp denomination i deliver the first address to the assembly followed by amp others","D&C 123:12",0.245051657,345,1897-03-01,"Doctrine and Covenants","For there are many yet on the earth among all sects, parties, and denominations, who are blinded by the subtle craftiness of men, whereby they lie in wait to deceive, and who are only kept from the truth because they know not where to find it--"
11774,"we passed over miles of barren plains still we passed many thoughsands of acres of corn","2 Ne. 5:28",0.245050584,371,1893-09-01,"2 Nephi","And thirty years had passed away from the time we left Jerusalem."
11822,"as i did i spent the day in the office i met wi the twelve at","D&C 18:27",0.244694348,323,1893-06-01,"Doctrine and Covenants","Yea, even twelve; and the Twelve shall be my disciples, and they shall take upon them my name; and the Twelve are they who shall desire to take upon them my name with full purpose of heart."
11785,"to sent her a ticket to amp returned bishop from called upon me about the election","D&C 53:1",0.244547884,360,1895-12-01,"Doctrine and Covenants","Behold, I say unto you, my servant Sidney Gilbert, that I have heard your prayers; and you have called upon me that it should be made known unto you, of the Lord your God, concerning your calling and election in the church, which I, the Lord, have raised up in these last days."
11833,"hour amp a half i then took street car wi amp brother newton amp rode to","Alma 11:15",0.244183687,312,1893-07-01,"Alma","A shiblon is half of a senum; therefore, a shiblon for half a measure of barley."
11830,"col trumbo he wanted to be elected senator i was sick this morning i attended meeting","D&C 123:14",0.244157333,315,1896-01-01,"Doctrine and Covenants","These should then be attended to with great earnestness."
11825,"the we spoke upon the subject of the meeting of nationalities like the danish amp others","D&C 29:10",0.244099653,320,1897-03-01,"Doctrine and Covenants","For the hour is nigh, and that which was spoken by mine apostles must be fulfilled; for as they spoke so shall it come to pass;"
11798,"went to the amp held a meeting wi the apostles we herd a letter read from","Mosiah 25:5",0.243778245,347,1896-10-01,"Mosiah","And it came to pass that Mosiah did read, and caused to be read, the records of Zeniff to his people; yea, he read the records of the people of Zeniff, from the time they left the land of Zarahemla until they returned again."
11837,"we stopped and bought some sea shells from a chinese girl on the road side brother","D&C 76:100",0.243718745,308,1896-08-01,"Doctrine and Covenants","These are they who say they are some of one and some of another--some of Christ and some of John, and some of Moses, and some of Elias, and some of Esaias, and some of Isaiah, and some of Enoch;"
11825,"meeting i had a sick night i spent the day in the office we held a","Hel. 14:4",0.243383168,320,1897-03-01,"Helaman","Therefore, there shall be one day and a night and a day, as if it were one day and there were no night; and this shall be unto you for a sign; for ye shall know of the rising of the sun and also of its setting; therefore they shall know of a surety that there shall be two days and a night; nevertheless the night shall not be darkened; and it shall be the night before he is born."
11787,"i took cars amp returned to and spent the night at home mile i attended the","3 Ne. 12:41",0.243184903,358,1896-10-01,"3 Nephi","And whosoever shall compel thee to go a mile, go with him twain."
11831,"a morris spoke first in the tabernacle followed by president they had a good meeting i","Mosiah 23:30",0.243127497,314,1896-11-01,"Mosiah","Now the armies of the Lamanites, which had followed after the people of king Limhi, had been lost in the wilderness for many days."
11779,"the dedication of the offered the prayer w woodruff spok amp dire c ted the services","D&C 42:73",0.242886676,366,1893-04-01,"Doctrine and Covenants","And the bishop, also, shall receive his support, or a just remuneration for all his services in the church."
11805,"met the presidents of seventies we met wi col amp talked over our affairs we visited","Alma 56:23",0.242816722,340,1893-10-01,"Alma","For we knew in those cities they were not sufficiently strong to meet them; therefore we were desirous, if they should pass by us, to fall upon them in their rear, and thus bring them up in the rear at the same time they were met in the front. We supposed that we could overpower them; but behold, we were disappointed in this our desire."
11772,"of the waters of amp we met wi eckles about the contract of the pavilion on","D&C 61:14",0.242770734,373,1893-01-01,"Doctrine and Covenants","Behold, I, the Lord, in the beginning blessed the waters; but in the last days, by the mouth of my servant John, I cursed the waters."
11777,"twelve in the a cold snow storm figures we received a letter to day from amp","Alma 26:6",0.242733457,368,1896-04-01,"Alma","Yea, they shall not be beaten down by the storm at the last day; yea, neither shall they be harrowed up by the whirlwinds; but when the storm cometh they shall be gathered together in their place, that the storm cannot penetrate to them; yea, neither shall they be driven with fierce winds whithersoever the enemy listeth to carry them."
11834,"work prest amp left for i spent the day in new ythe office attending to the","Ether 13:9",0.242517241,311,1894-01-01,"Ether","And there shall be a new heaven and a new earth; and they shall be like unto the old save the old have passed away, and all things have become new."
11842,"spent the day at home figures my dhter who ried joh john daynes jr joh danes","1 Ne. 21:4",0.24246494,303,1896-11-01,"1 Nephi","Then I said, I have labored in vain, I have spent my strength for naught and in vain; surely my judgment is with the Lord, and my work with my God."
11835,"sugar trust st i pspent a bad night at one time my brea seemed to stop","Jacob 5:66",0.242434633,310,1897-03-01,"Jacob","For it grieveth me that I should lose the trees of my vineyard; wherefore ye shall clear away the bad according as the good shall grow, that the root and the top may be equal in strength, until the good shall overcome the bad, and the bad be hewn down and cast into the fire, that they cumber not the ground of my vineyard; and thus will I sweep away the bad out of my vineyard."
11846,"clock and registered at the hotel del coronado san diego san diego county california coronado hotel","D&C 128:20",0.242247011,299,1896-08-01,"Doctrine and Covenants","And again, what do we hear? Glad tidings from Cumorah! Moroni, an angel from heaven, declaring the fulfilment of the prophets--the book to be revealed. A voice of the Lord in the wilderness of Fayette, Seneca county, declaring the three witnesses to bear record of the book! The voice of Michael on the banks of the Susquehanna, detecting the devil when he appeared as an angel of light! The voice of Peter, James, and John in the wilderness between Harmony, Susquehanna county, and Colesville, Broome county, on the Susquehanna river, declaring themselves as possessing the keys of the kingdom, and of the dispensation of the fulness of times!"
11808,"blessed we talked over business in the temple i spent the day at the wi president","D&C 102:9",0.24208685,337,1896-05-01,"Doctrine and Covenants","The president of the church, who is also the president of the council, is appointed by revelation, and acknowledged in his administration by the voice of the church."
11791,"building i was called upon to address them the scene perfectly overpowered me as the whole","D&C 105:10",0.241896176,354,1897-02-01,"Doctrine and Covenants","That they themselves may be prepared, and that my people may be taught more perfectly, and have experience, and know more perfectly concerning their duty, and the things which I require at their hands."
11803,"board we voted to lair a dividend of per cent figure in company wi amp several","D&C 20:81",0.241754735,342,1893-06-01,"Doctrine and Covenants","It shall be the duty of the several churches, composing the church of Christ, to send one or more of their teachers to attend the several conferences held by the elders of the church,"
11837,"trees wide spreading lawns and every variety of flowers we rode through the pacific drive about","Jacob 5:58",0.241684564,308,1896-08-01,"Jacob","And we will nourish again the trees of the vineyard, and we will trim up the branches thereof; and we will pluck from the trees those branches which are ripened, that must perish, and cast them into the fire."
11789,"rest of the day at home i attended meeting at the wi amp wi a large","D&C 123:14",0.241395684,356,1896-08-01,"Doctrine and Covenants","These should then be attended to with great earnestness."
11782,"charles samuel burton charles burton amp bishop on debts i met wi the twelve in the","D&C 104:78",0.241023178,363,1897-02-01,"Doctrine and Covenants","And again, verily I say unto you, concerning your debts--behold it is my will that you shall pay all your debts."
11787,"do while holy ghost should be wi every saint of god to reveal to him his","3 Ne. 28:11",0.240869086,358,1896-10-01,"3 Nephi","And the Holy Ghost beareth record of the Father and me; and the Father giveth the Holy Ghost unto the children of men, because of me."
11798,"i found that the company was improving upon any former year the last time i was","1 Ne. 4:8",0.240236003,347,1896-10-01,"1 Nephi","And when I came to him I found that it was Laban."
11786,"come home wi him we had a great deal of company to day president is called","D&C 102:9",0.239932303,359,1896-04-01,"Doctrine and Covenants","The president of the church, who is also the president of the council, is appointed by revelation, and acknowledged in his administration by the voice of the church."
11825,"in the office the pineer electrict meeting occupied nearly the whole day in setting wi mr","D&C 107:91",0.239768973,320,1897-03-01,"Doctrine and Covenants","And again, the duty of the President of the office of the High Priesthood is to preside over the whole church, and to be like unto Moses--"
11807,"upon me amp had a talk i spent most of the day in the office i","D&C 107:68",0.239625066,338,1897-03-01,"Doctrine and Covenants","Wherefore, the office of a bishop is not equal unto it; for the office of a bishop is in administering all temporal things;"
11817,"i paid taxes total i met wi the twelve in the had prayers and a council","Alma 13:15",0.239508571,328,1893-10-01,"Alma","And it was this same Melchizedek to whom Abraham paid tithes; yea, even our father Abraham paid tithes of one-tenth part of all he possessed."
11844,"put it into the hands of my lawyiers amp i spent the day at home reading","Mosiah 25:14",0.239251594,301,1893-07-01,"Mosiah","And now it came to pass that when Mosiah had made an end of speaking and reading to the people, he desired that Alma should also speak to the people."
11842,"recepts for disbursments cash on hand the institution is doing well presidents amp went to i","D&C 64:33",0.23879793,303,1896-11-01,"Doctrine and Covenants","Wherefore, be not weary in well-doing, for ye are laying the foundation of a great work. And out of small things proceedeth that which is great."
11837,"acres we passed through a herd of large ground squirrels and had a view of a","D&C 5:13",0.238726171,308,1896-08-01,"Doctrine and Covenants","I will give them power that they may behold and view these things as they are;"
11789,"sick had a meeting of the power company at oclok ap m we were visited by","D&C 84:68",0.238707202,356,1896-08-01,"Doctrine and Covenants","In my name they shall heal the sick;"
