internal_id,text,verse,probability
12014,condition so that i cann lay my hands on them at any time went home at,3 Ne. 15:14,0.31256183164624124
12009,afternoon wi a type written paper purporting to be a copy of the minutes of the,Alma 25:10,0.31243590517118663
12023,do not feel that i can leave on this trip until next bro spence reported that,D&C 118:5,0.3123750676407022
12065,i attended the young mens conference in the forenoon in the delivered a lecture to the,D&C 123:14,0.31234190925900657
12032,us to the rgw depot at pm on the train bro nuttall read to me the,Mosiah 25:5,0.3121044491611159
12010,felt well rec telegram from left for some arrangements were made for the utah loan amp,D&C 104:84,0.31188915604813844
12024,at the temple at am and in the afternoon a meeting of the board of directors,D&C 84:4,0.3117747912005623
12025,had a notification from that we must place to there credit at the bank i wrote,Omni 1:9,0.31175596584464293
12033,thebook of mormon which he prized very highly at a gathering of a portion of his,Mosiah 18:30,0.31129938568461174
12037,people a single thing took place ried his brother years ago and for some cause he,D&C 76:100,0.3112924553434933
12010,wed went to the office i did not sleep well last night been very busy at,Alma 51:33,0.31127531830659183
12042,for some time and which has been made quite clear to me in regard to the,D&C 76:100,0.3110415883157854
12064,met wi the priesthood in the whare much business was done among other things made a,Alma 10:31,0.3107880204888944
12033,of prest wm paxman on thur nd prest woodruff was called upon by col dickinson and,D&C 136:13,0.3107734786571656
12044,in portland is brought in pipes also mt adams we passed our time very pleasantly until,2 Ne. 5:28,0.3106071565086245
12015,they settelled the matter for the present we went up the canyon to the place whare,Mosiah 20:7,0.3105484676944795
12027,all night wi me st i had a very poor night had some distress in my,Hel. 14:4,0.31038533288885
12028,so many of the sisters officiated for my dead in the temple elder l j nuttall,2 Ne. 5:16,0.3103838544505178
12028,at called at amp then home bro accom panied me amp read to me the journal,2 Ne. 27:18,0.3102733044375011
12043,our business figure i wrote a letter to in same envellop wi she also sent photos,Omni 1:9,0.3101941646766882
12037,this silver company was composed of about a dozen govornors a dozen members of congress and,Alma 11:6,0.30997915924771796
12060,mutual improvement officers at christensens hall at pm i met many friends and made some reks,3 Ne. 6:11,0.309933038849369
12030,the ward were presented amp received then g q cannon spoke one hour followed by w,D&C 29:10,0.3095996805434864
12024,the funeral services were held at the at pm the speakers were bp bro ex gov,Hel. 9:11,0.30950768455971445
12051,pm thurs at the office this morning i attended my usual meeting at the at a,Ether 4:9,0.3093288515125771
12044,traveling down the saw the cascade locks amp falls amp fishing boats on the river we,Alma 43:53,0.3092410081910922
12069,amp several other ladies when we arived near we took a side trak amp remained untill,Alma 58:13,0.30915085313678353
12056,the morning i had the brethren administer to me being mou dr called and after breakfast,D&C 20:76,0.3090368707020327
12050,to the office did not have a good night two of my relatives from called to,Hel. 14:4,0.3088668970594555
12025,received letters from to father amp amp to good letter we had a sugar meeting we,2 Ne. 28:27,0.3088286061455254
12005,to day in the news herrald amp tribune the orginization of the utah company wi the,Alma 13:25,0.3087522621225002
12026,figures i received a letter from to on read letter day it was quite interesting he,D&C 44:1,0.30868804585075593
12043,wi amp missionaries from the indian mission i also met wi member of parliment amp a,D&C 71:3,0.30864498657461586
12049,read spoke m spoke m i attended meeting wi the presidents of stakes amp authorities of,D&C 29:10,0.30833523287939274
12031,brigham young monument this afternoon amp i placed the small box containing coins amp other relics,D&C 124:127,0.30825278719008326
12007,following address brethren amp sisters as president of the church i have many duties to perform,D&C 107:88,0.3082415872586816
12061,felt very tired amp did not rest very well during the night nd i slept some,D&C 97:18,0.30805738223830154
12067,dollars wor of goods annually and he purchases the goods mostly in he performed a good,4 Ne. 1:25,0.30793983756473825
12006,my councillors went to the lake brought to my house my patriarchal blessing by the patriarch,D&C 124:92,0.30787358416286936
12050,at pm before leaving myself amp pres met wi prest amp com m amp prof in,Ether 1:12,0.307515305858258
12067,valley wi his father and mother in phebe lost dhters in childhood amp grew to womanhood,Alma 45:24,0.3072740242840255
12023,to be heard in the i prepared a few thoughts and had them written to be,3 Ne. 26:18,0.3070611377311479
12070,clap of thunder sounded right over our head while at the office bro hiram bradley clawson,D&C 28:6,0.3068942248236729
12042,and arrived at the city at was there haand took us direct to the office where,Alma 56:15,0.30688001782529595
12036,at whih where owen amp others got another another tongue amp drove to hinckley bro smi,Moro. 10:11,0.30682275563977757
12013,wi him to see our improvements and the changes now going on while his wife was,Alma 18:43,0.30671249966250513
12004,somewhat curiously the well borers amp fence makers are busy at their work amp my man,D&C 98:19,0.306629946844989
12031,allowance for my meeting of z s b amp t co as i could not attend,D&C 1:31,0.30662388956971404
12017,the night sat up amp read some of the time slept very well went to the,Ether 15:20,0.3065144126777516
12038,slept well before midnight i slept some hours after midnight to am after breakfast walked out,Ether 15:20,0.3064154709203207
12018,murderer was shot to day he was a vary foul mou man i spent the day,Hel. 9:38,0.30606675690212315
12008,brother presented to us the condition of the brigham young academy provo utah county utah territory,D&C 126:1,0.30599147287505973
12004,pm when i went home wi my wife i attended a social gathering at the residence,D&C 58:24,0.3056208066344241
12018,amp father we had an interview wi orson smi orson smi spoke well of the spring,D&C 34:1,0.3053539985006741
12059,this is the bir day of myself amp wife i have lived yeres to day and,D&C 63:58,0.3053064337577404
12031,morning amp after lunch returned home rd i was at home all day i sent for,D&C 19:36,0.305068649068229
12050,see me amp i appointed to meet them at my house this evening left for home,D&C 19:36,0.304369491844137
12008,pages i gave him some account of my temporal affairs we the presidency took cars amp,D&C 29:35,0.30429911800896087
12016,we have received from him since he left i did not sleep i went to the,Alma 55:8,0.30414125743170567
12022,p m in meeting most of the time on the matters of called in to see,D&C 102:28,0.30359318222805987
12041,came amp sat up wi me tonight bro nuttall also wi us i did not sleep,Mosiah 24:19,0.3034044313064949
12061,the day are to be held after the firing of cannon amp c the ceremonies commenced,Ether 4:17,0.30314874386455465
12004,family and retired to bed at pm amp slept had a fairly good night after breakfast,Ether 15:20,0.30293832223275685
12026,attended the celebration of the riage of to brother we had a large meeting in the,Alma 52:12,0.30275760858707834
12011,to him as he had felt i was so much improved in my heal we started,D&C 84:68,0.30263988645321066
12015,there is tons of ore out in the mine as deep as they have gone down,2 Ne. 28:11,0.3026242391809947
12012,kingdom of god that god had sealed upon him and commanded them to bear off the,Mosiah 29:3,0.3021404921106062
12011,residence of the late elder his body lying in state i expected to attend the funeral,D&C 58:24,0.30193775051444416
12029,being in the middle of the day and the water covered wi moss i cht one,3 Ne. 11:26,0.3016636745294667
12018,at home reading i mailed figures letters to amp from amp father amp to blanch from,Mosiah 25:14,0.301579140571887
12061,you this was done in the presence of some children seated in the tabernacle a beautiful,D&C 137:3,0.3015292281596822
12061,the proceedings at the in the afternoon and received a beautiful bagold badge as did also,Mosiah 15:15,0.3014935205014506
12040,us today we give them the use of the to night to hear the organ amp,D&C 42:50,0.3011808256301929
12068,a restaurant of clam chowder roasted oysters amp c went to golden gate park amp to,3 Ne. 14:13,0.3003826956678856
12070,young men along upon whom he had previously operated amp showed some tricks also made explanations,Ether 12:7,0.3001157049217857
12038,i went to bed early amp slept well before midnight i slept hours from midnight till,Ether 15:20,0.30010611888516525
12024,at the office quite busy and went home at pm fri spent the day at the,Ether 4:9,0.30006265174975116
12022,to the office was quite busy until p m amp then went home tues at the,3 Ne. 21:28,0.2998475786297442
12007,wi the inhabitants of the ear in the day and generation in which we live i,1 Ne. 3:15,0.29929727432715203
12025,telegram from smi amp we met wi the ogden power co i went to the wi,1 Ne. 3:23,0.2991685962317222
12017,there will be any objections in having the same printed in pamphlet form for distribution i,Jacob 1:10,0.29903698520341926
12014,a list of all my journals amp put them in good shape tues at the office,D&C 20:82,0.2989787761422926
12049,to we met at the office in terocean we had a good deal of company i,Alma 56:23,0.2984974821323517
12034,amos woolley samuel w woolley bishop of the ward of his bir day we made some,D&C 76:100,0.29807214952784533
12024,i handed my st journal to bro amp requested him to find the record of my,D&C 72:6,0.2980643173008841
12034,about a large quantity of land at the head of that we ought to possess we,D&C 28:6,0.29802009381377337
12050,well was quite busy all day and went home at pm sat i staid at home,D&C 19:36,0.2979511790907431
12008,interest of the amp the church we set him apart for the mission blessed his child,D&C 68:14,0.2978984111259032
12025,of the state figure i went to the office this morning and signed notes as trustee,Alma 40:14,0.29767896445189557
12035,of myself amp bro to go to and return found i had my annual passes amp,3 Ne. 2:9,0.2976507957974724
12052,now in the and i requested bro nuttall to find him amp bring him to see,D&C 45:14,0.2974914375533197
12023,drove to the office this morning and attended my meeting at the afterwards drove home went,Mosiah 21:8,0.2973835309780696
12064,the afternoon amp evening till near midnight the semi conference of the church of jesus christ,3 Ne. 26:21,0.29717530378364543
12071,meeting of the union light amp power co for the purpose of raising some bro is,D&C 76:100,0.2970983739228576
12023,to the office this morning and attended to such business as came before us i requested,Alma 56:41,0.2969640284633063
12070,after supper went to bed amp slept fairly well until midnight st i slept very well,D&C 58:9,0.2966964001829912
12020,a ba at and dressed this being fast day i did not eat in the afternoon,1 Ne. 14:19,0.29664776878403826
12051,and let the bank go out of existence i spent the evening at my frison residence,D&C 58:24,0.29640730398374526
12010,was busy all day amp returned home at pm wed was at the office all day,D&C 34:8,0.2963744259431014
12067,amp motherhood my wife bore me sons are still living drowned at years of age died,Ether 9:24,0.2962850577333524
12011,i then rested amp slept for over an hour afterwards walked out again ate dinner wi,Ether 15:26,0.2961141026932726
12042,left on this evnings train for on railway business amp c sun i spent the day,3 Ne. 12:45,0.2957102734850276
12064,one hour followed by afternoon authorities presented amp sustained spoke hour followed by w woodruff i,D&C 29:10,0.2956756438099193
12015,at a ton which would be tons per day i spent the day at home choreing,D&C 43:17,0.2954940639504331
12056,dreams last night also of my journals and madam who is now in there being nothing,Hel. 14:4,0.2954241206683524
12050,able to attend to the duties of my calling i attended a social party gotten up,D&C 20:47,0.2953721718552061
12010,and its people which was very interesting and illustrated by stereophican views mon at the office,D&C 5:28,0.29528970412040173
12065,to of pages amp one from his i am in poor heal figure i received a,D&C 84:68,0.2952106028398358
12070,took lunch at the office at left for home i accompanied amp to and returned at,3 Ne. 15:14,0.2951618595994796
12052,been asked to take any part in the pioneer proceedings whilst the clawsons and their friends,Jacob 3:13,0.29483227579426546
12044,when having heard so much about the southern pacific shasta route to we concluded to take,1 Ne. 17:6,0.29466624552130366
12068,school of whales amp passed cape blanco lighthouse at saw more whales amp porposes after dark,1 Ne. 12:5,0.29456535636726183
12065,hands of to attend to we had an interview wi col who has just returned from,Mosiah 2:4,0.2945268626372485
12017,office this morning and stayed attending to such matters as came before us until pm when,Alma 56:41,0.2940307663254515
12026,gov wi men amp women of all creeds in a social form all were quite free,D&C 98:8,0.2937634870385119
12032,amp son came wi the horse amp buggy at and we drove to the depot left,Mosiah 21:8,0.29369208592876295
12052,entitle me to some consideration not one of my sons or any of my family have,D&C 76:100,0.2936175114723985
12063,he went to liberty park and shook hands wi about children who were there for a,Alma 46:28,0.2935572938059267
12022,several meetings amp went home at pm st i drove to the office busy all day,D&C 20:44,0.29306162848589457
12028,wife called and wished me to administer to their child as they had come the consequence,D&C 104:51,0.29302264975659414
12035,a general holiday did not go to the office had a better night went to the,D&C 128:4,0.2928741790749678
12057,mens conference met in the speeches were made by amp other brethren,D&C 72:7,0.2928002401789203
12010,trust co amp elder will go to tomorrow to see about it thurs at the office,D&C 107:7,0.2927509069010221
12011,bed i slept soundly for hours i slept some of hours from midnight to a m,Ether 15:20,0.29272836871308355
12015,the river to their work we all went up the canyon and after conversing wi leaders,1 Ne. 3:23,0.29264173181282066
12060,home sat at home all day feeling first rate sun spent the day at home resting,D&C 19:36,0.29257061597738576
12025,the twelve the democrat s held a political convention at and nominated their candidates for offices,D&C 18:27,0.2925362474442958
12004,in which he says he can get together his family amp some of his friends occasionally,D&C 76:100,0.2924167593207702
12055,up the many well cultivated farms amp fruit orchards is a fruit center from which place,2 Ne. 13:10,0.29240683511979215
12069,a load of grain was buried to day spok at the funeral we were visited by,Alma 24:19,0.29197766432532274
12038,routine business until pm arrived at home i soon laid down amp slept for hours ate,Ether 15:26,0.29165049537003207
12021,the business of the office i received figures a letter from to father amp i mailed,D&C 44:1,0.29158297204452405
12029,piano amp pays for it in her wages as a teacher in the afternoon i attended,D&C 124:122,0.29155493145914624
12008,mormonism which was quite interestin i attended a party wi my councillors amp many others at,D&C 123:14,0.29148493429652605
12069,went on board of private car wi himself amp family at we took aboard amp wife,1 Ne. 16:7,0.2914671098855437
12006,we held the meeting for several hours brother kept minuts the sale of pipe spring was,D&C 20:81,0.2911610178791857
12061,this morning and attended a part of the services of the jubilee on childrens day at,D&C 112:5,0.29093025976485554
12006,the lake in when we came in the pioneers years ago these are ownly time i,D&C 76:36,0.2909037480727388
12038,son years old named called at pm i ordained the boy to the office of deacon,D&C 20:60,0.2906901912139561
12043,meetings i received figures a letter from i wrote him a letter o f sheets i,D&C 44:1,0.29063511027352024
12029,our company went to brother at the mou of the amp in company wi brother madson,D&C 76:67,0.2905219602644612
12012,lord revealed to the prophet and said that angels were standing in the temple in heaven,Hel. 9:40,0.2903995571758406
12021,twelve in the the subject of the holy ghost was discustsed wisdom says let mysteries alone,D&C 107:58,0.2903673104913051
12060,myself bro helped me in looking over some of my letters amp put them in good,D&C 76:100,0.29021895077786825
12070,until am after breakfast i sat in my room as it was raining out doors called,D&C 138:1,0.28997317796878364
12039,was counted the best fair ever gathered in i went to the conference in the afternoon,Moro. 7:7,0.28995361524454966
12029,him in writing our answer to his leangthy communication he returned to his room to read,Mosiah 25:5,0.28978334059027333
12047,my daily journal which is recorded in the back part of this book we had a,D&C 128:7,0.2892626097828068
12053,to amp one to had an interview wi he says a man cannot mortgage his wifes,Alma 5:31,0.28903838412070176
12059,me sons and dhters one son died in childhood sons grew to manhood and bo are,Alma 48:18,0.28879819156204767
12049,was held in the assembly hall president presented the authorities of the church and reports was,D&C 102:9,0.2885890190434592
12038,o clok a m also for hours before oclock drove to the office and attended the,D&C 123:14,0.2884136129589031
12034,shed a battle or of the mob shot we had several meetings to day met wi,D&C 135:1,0.28836205186366376
12005,of the committee were apointed to go east amp meet gen amp moses thatcher called i,D&C 94:15,0.2878871141548236
12004,drove to the office i wrote a letter to madam amp mailed it quite busy until,Omni 1:9,0.2878778948115437
12028,accompanied me to bro roberts at we returned about pm i soon went to sleep i,Mosiah 24:19,0.2876895285860449
12044,to prayer bro being mou asking the lord to bless us and that we be directed,D&C 10:15,0.28745320745541897
12037,return i was quite unwell during the day called upon me in the evening,Alma 34:21,0.2871550023354046
12027,came this evening he having been to the past two days amp staid wi me all,1 Ne. 1:1,0.2869633401457868
12047,spent the day at home choreing figure i met wi my family in the evening and,D&C 19:36,0.2869015699715233
12021,isaiah from the verse and spoke to the people was followed by amp we then took,3 Ne. 16:17,0.28686930957061213
12038,gave him permission to do so ate supper wi the family brought down about o clock,3 Ne. 17:12,0.28675732819871075
12013,visiting wi he read me a telegram he had received respecting our contemplated trip to as,1 Ne. 1:12,0.28654110845635505
12044,that trip bro procured the tickets for each including our sleeper in consequence of the cut,D&C 138:54,0.2863567222218851
12008,rode to amp met wi the power company amp learned that the opposition company had stoped,2 Ne. 27:19,0.2862402272674282
12026,evening took supper about oclok went to bed at miles we returned to i stoped at,1 Ne. 1:7,0.28608645374212377
12063,in arizona in the early part of and instructed his family to remember the thngs con,D&C 1:26,0.2859895204136742
12044,not do anything displeasing to the lord i then laid my hands on bro nuttalls head,D&C 28:6,0.2857378668023423
12030,woodruff minuts then returned home m on my return home i had a fall over a,3 Ne. 21:28,0.2856715827815313
12037,observation through wi dr i went to the office amp met wi simon bamberger simon bamberger,D&C 107:68,0.28559382397766037
12049,met wi the power company in the morning and spent most of the day in the,D&C 112:5,0.28554506995435086
12065,to attend which i will endeavor to do if i can called upon me saying some,D&C 76:100,0.28550712858158794
12012,fulfilled that god has promised therefore judgment awaits the wicked president followed and bore his testimony,D&C 58:31,0.28526600539638913
12014,to the office attended my meeting at the at am till pm afterwards at the office,D&C 107:68,0.2851375663030027
12023,he had made the necessary arrangements for trip i feel quite unwell today in my stomach,D&C 129:5,0.2851064501564883
12037,most of them eminent they spoke vary highly of the beauty of amp the accomodations they,D&C 42:40,0.2848256967676151
12047,reading figures i received letters from amp i one from to i wrote letters to sarah,Alma 54:15,0.2845851039441246
12028,was also present wi us on that day in my work i did not sleep much,Mosiah 24:19,0.2845502364071619
12046,medicine i had some good sound sleep amp felt much better this morning after breakfast walked,Mosiah 24:19,0.28441427109437384
12040,day under the pavilion whare it was cool amp comfortable we returned to the city at,Mosiah 21:1,0.28423312837130876
12051,they having some company until oclock fri i feel somewhat tired this morning but went to,D&C 76:100,0.28417711977289467
12068,the hotel near the top is a very commodious house from the hotel bro walked to,Alma 50:5,0.2841710820370771
12058,the board of amp heard their report i met wi many persons i had several meetings,D&C 20:44,0.28394927124310476
12006,interview wi the man we are doing business wi amp in the evening we went out,1 Ne. 3:23,0.28380456458593845
12050,arrived on time at the city our carriages awaiting us amp drove home wed i drove,Mosiah 21:8,0.28379222273025617
12044,ere we were comfortable amp took our meals as we wanted them i got some clam,Alma 56:57,0.28370604477279965
12030,home the family went to figure all rail roads in the united states are tied up,D&C 19:36,0.2836213087967908
12031,my meeting at the at am nd went to the office for a short time this,Alma 13:24,0.28358710506319273
12038,mrs amp amp went to the i slept some hours from midnight to am amp sister,D&C 76:100,0.28341931120517605
12012,be burned i now bear testimony to this assembly that that day has come these destroying,Alma 24:20,0.2834156157814162
12039,a change was moved from amp sent to preside at and to labor wi whit which,3 Ne. 1:20,0.28341005218396054
12068,early had good breakfast took a cab at a m amp drove to the steamer columbia,D&C 88:83,0.283374231158619
12030,spoke in the forenon about minuts amp w woodruff minuts in the afternoon the authorities of,D&C 102:32,0.2833227302137696
12046,had a good sleep on the sopha sat up amp conversed wi amp until oclock amp,Alma 19:34,0.283320456860189
12017,told her that myself amp counselors would consider the matter i was quite restless most of,D&C 124:142,0.2831549773227742
12027,of this to day i rested the latter part of the night having got my mind,D&C 10:44,0.28310623855059225
12043,college question we had a hard rain to day i went to the amp attended to,D&C 123:14,0.28309194763070944
12039,was pleasing to him i am still quite poorly i went to the office amp wrote,1 Ne. 6:5,0.28296388563721175
12009,nuttall staid wi me amp brought letter from which we read sister called on me this,D&C 44:1,0.2828055338571922
12011,at i ate my breakfast and dressed at am my wife accom panied me to the,Ether 4:9,0.2827716095069149
12069,figures i mailed a letter to day to from father amp in company wi amp i,D&C 44:1,0.2826397725307404
12041,i ate some bread amp milk amp bro shaved me i felt like going to the,Alma 8:22,0.28260593124405176
12031,wi a catheter as it is necessary to use that instrument at home all day i,Alma 39:18,0.28255108909686794
12042,amp c wednes day rd drove to the office feeling well i thought it for the,3 Ne. 13:34,0.28244566167489227
12043,the past mon was discussed started for to day we met wi professors amp on the,Mosiah 7:3,0.28239057457320843
12034,addressed the assembly in the afternoon president woodruff addressed the assembly followed by president followed by,D&C 102:9,0.2823161919321242
12050,we drove to the station and found the special car ready amp waiting for us which,D&C 86:5,0.28190029942201156
12052,of an hour at my desk looking over some papers i wished to see drove around,D&C 76:100,0.28182529270592904
12058,this i could not do as it was against the law of god as cain killed,Hel. 6:27,0.28174699224520555
12039,to my bed amp room untill the nd day of for days prest visited me for,1 Ne. 6:3,0.2815164152165424
12018,business figures i spent the day in the office amp had an interview wi general amp,D&C 128:4,0.2814984385869528
12017,the office spent the day at home bro went to today au i was at home,D&C 19:36,0.2814835094571344
12020,wi my family oclocki took dinner at bro wascalled also prest in the evening i relieved,Alma 62:29,0.2814638951577693
12031,for over an hour this day is observed as a general holiday i drove to the,D&C 128:4,0.28140765586150884
12017,condition of the utah loan amp trust co and appointed amp a committee to make further,D&C 94:15,0.2813942239019741
12024,i requested bro to arrange for me to see mr now living in the pres left,Jacob 7:22,0.2812934507875893
12068,o clock had a good night and at breakfast time passed reef we saw a large,2 Ne. 5:28,0.2812615926180632
12035,this evening i had a good night slept well i told of my contemplated trip to,Ether 15:20,0.2811793543073194
12052,better not but to save my streng rode out an hour this afternoon had a good,D&C 51:17,0.281161029133927
12018,cht by the company i was quite weary at night m i spent the day in,Hel. 14:4,0.2810766866275237
12032,family there went to the office and requested bro to accompany me we arranged to go,2 Ne. 5:6,0.28103350236653923
12030,the rr being tied up all through the u s we met in the i visited,Morm. 1:15,0.28100964549641494
12056,at the pres gone to i had some conversation wi elder in regard to my disagreeable,D&C 76:100,0.28099469891302975
