internal_id,text,verse,probability
12064,board amp entered into arange ment to reorganize for years more i had a meeting wi,Mosiah 6:2,0.2809800346050836
12013,sulphur i con cluded to have them drive further in hope of getting good water had,Alma 17:26,0.2808803936460949
12023,amp bowels amp also wi my water so that i have not left my room i,3 Ne. 17:6,0.2807153921113737
12071,wed nd at the office feeling better of myself i wrote to m mountford it rained,Omni 1:9,0.2802930661453216
12055,we reach an altitude of feet a raise feet in miles fields amp orchards in sight,D&C 84:109,0.280001172751866
12022,letter from amp answered it returned home at pm fri i am feeling some better wi,Alma 18:19,0.27988328106413807
12070,carter scholes saville phebe scholes amp her called i did not sleep much before midnight i,Mosiah 24:19,0.27980306028056734
12069,letter to amp i sent ten dollars to sarah we were visited by gentlemen from and,D&C 104:73,0.27976265335992867
12029,german amp latin amp had received the highest diploma given in the instituion she bought a,D&C 132:42,0.27968773450540485
12067,academy i spent the day at the office attending to my duties and in the evening,D&C 107:86,0.27968423116269353
12028,time in looking for it but without effect came to the office this morning he has,D&C 54:4,0.2794834137675678
12039,i attended the semi annual conference at the all the presidency amp twelve were present except,D&C 94:3,0.2794275183376618
12064,wrote letters amp sent means to my family figure we met wi officers of the savings,Omni 1:9,0.2793039731117295
12055,of country is used as summer resorts for the city people at we see the crags,D&C 130:1,0.2792979149786619
12017,of my papers and bro amp myself examined a portion of my desk but did not,Alma 36:4,0.27925822658810007
12021,dinner persons seated at the table at the close of the feast the children gathered in,Alma 20:9,0.2790545078375165
12025,owen letter i had many callers in the morning i wrote a recommend to we had,Moro. 9:21,0.2790262146839831
12022,to assist me at home during the night amp to assist me at the office during,D&C 124:31,0.27887512059743114
12053,amp nurse me which he did do i was quite poorley this morning was nursed through,D&C 76:26,0.27885073862866855
12020,nd i slept and dozed for hours from midnight was troubled wi phlem amp coughing took,D&C 45:34,0.27882783344502393
12063,persent and asked that it be pressed and kept in memory of the occasion he notes,4 Ne. 1:19,0.2785107844284157
12053,who gave us a history of one of the elders who was preaching and saying that,Alma 10:3,0.2783268536576857
12067,dhter in childhood but raised four to motherhood all noble women my first wife bore me,D&C 58:10,0.27823691157349684
12050,bros cannon maeser amp left by this mornings train for the conference convened at pm after,D&C 28:10,0.2781850700450689
12070,office at called at on the way while passing through the eagle gate a very heavy,3 Ne. 14:13,0.27805185544785116
12060,feeling well i attended my usual meeting at the at am afterwards at the office till,D&C 98:19,0.27800304578355184
12027,saw the play of rosey by john drew amp co bro was wi me amp staid,D&C 93:6,0.2778586061588007
12036,dam amp examined the same then drove to the farm when near the farm was driving,D&C 63:38,0.2778293549397288
12060,usual meeting at the bro attended to me amp i went home at pm fri i,D&C 123:14,0.27776522000117054
12044,time and went to bed i slept very well amp had a good night arose early,Ether 15:20,0.2776836834838671
12046,medicine i staid at home all day called this afternoon on going to bed i slept,Ether 15:20,0.2775986750883312
12041,staid at home all day bro nuttall staid wi me tonight and i dictated an answer,D&C 133:65,0.2772772213088355
12017,no ision was arrived at bro nuttall came and sat up wi me tonight prest geo,Ether 14:9,0.27722820566155076
12024,accompany us wed i went to the office amp remained all day signed a number of,2 Ne. 2:22,0.2771281234203187
12007,unto you at this time it is reppresented to us that there is about fourteen hundred,D&C 9:3,0.2770857305393421
12052,and associates are into everything i felt like sending for bro so as to free my,D&C 98:8,0.2766552357884867
12052,came in the evening and sat up wi me during the night i spent a fairly,D&C 138:36,0.27662889790246836
12032,finding them all well tues i had a fairly good night bro leonard john nuttall nuttall,Hel. 14:4,0.27656210260516534
12047,i met several of the twelve at the amp had prayers i spent the day in,D&C 20:81,0.2765210671209356
12047,rain amp snow storm last night the ear soaked amp returned from the east amp wife,2 Ne. 14:6,0.27630684228926783
12013,ys hospital this morning and operated upon for appendicitis i drove to the office and thence,Mosiah 21:8,0.2762108228756453
12038,called at i ate breakfast and went to the office at am was quite busy most,Alma 8:22,0.2758998558431846
12007,to escape those tremendious judgements which have now commenced to visit the ear i will answer,D&C 133:65,0.275884937805912
12033,united states sun pres w attended an inter esting lecture in the tabernacle on russia and,D&C 87:3,0.2755997135809223
12034,we met in the bowery there was quite a large congregation for in the forenoon president,D&C 102:9,0.27551968341999283
12036,amp amp other brethren were there wi teams amp c we drove to the reservoir amp,D&C 136:5,0.2752750152843591
12037,amp amp enemies were trying to destroy beck financially in company wi phe i rode to,3 Ne. 7:11,0.2752475786796686
12011,services this afternoon but dr thought i had better not do so as i am not,D&C 42:72,0.2749160558500215
12032,in the r g w train at pm i attended to my labors and bro drove,D&C 123:14,0.2746437994695936
12067,apostles in the fall of and is thoroughly fulfilling his mission as an apostle lost one,D&C 58:16,0.274424235032543
12061,went to zcmi where seats had been prepared so we could view the parade of the,Mosiah 11:11,0.27438258752715833
12042,stating that he amp his mother expected to return on next i wrote to i am,Omni 1:9,0.2743784833393688
12060,thur i called on pres this morning found him in bed quite unwell symptoms of a,D&C 76:26,0.27424425999236596
12051,to try and raise amp purchase the bank building pay off the mortgage and other indebtedness,D&C 63:30,0.2740245500333057
12028,slept hours before midnight and hours after till am ate some corn meal mush amp cream,Ether 15:26,0.2738106414261894
12036,rested we attended the stake school conference at am bro in charge the sacra me nt,D&C 97:3,0.2735727966540012
12030,united states being tied up on a strike stoped all business on rr nd figure i,D&C 87:3,0.27332941795889515
12024,a letter from m mountford i had some talk wi my dhter about her personal affairs,D&C 44:1,0.2733154127881269
12053,my lungs i went to the wi the twelve we talked over the subject of re,D&C 18:27,0.2733107346397578
12014,fri ap at the office busy wi the salary committee they cut my salary i signed,D&C 94:15,0.2732642411393971
12051,the office and attended to the current business amp went home at pm i wrote to,D&C 123:14,0.2731934738297086
12059,my wife emma years i have had to acknowledg the hand of god in the preservation,Mosiah 1:14,0.2731541864553603
12031,was a family gathering at the residence of this evening i did not attend st i,D&C 58:24,0.2731316195672723
12068,lunch and supper i went to bed at and slept very well tues st arose at,D&C 58:9,0.2731237134128972
12013,for my wives amp families while at the office nd i am not feeling well this,D&C 98:19,0.2731146298665852
12024,riage to my wife for use in the which he found i attended my usual meeting,D&C 123:14,0.27302339492394606
12009,seemed to be relieved of every strain and enjoyed a peaceful feeling throughout the house alice,Alma 62:29,0.27295126398171793
12055,amp went to bed fri arose early had a good night had our breakfast on the,D&C 88:124,0.2724979036305678
12064,of latter day saints met in the big tabernacle this morning w w spoke m m,D&C 115:4,0.2724791911614126
12005,resting i mailed a letter to this morning wi letter figures from father amp prest returned,D&C 44:1,0.27229740728494156
12055,started on our trip at pm on car triumph travelled up the river passed amp amp,Mosiah 7:3,0.27225356788368726
12061,sight after which i went to the office where mr johnson came and took my photograph,D&C 68:7,0.2721191537249661
12028,board of directors of z s b amp y co at p m left the office,D&C 107:68,0.2720889814622155
12052,and in the evening expressed myself vigorously as to the manner i have been treated i,D&C 84:54,0.2720657238236604
12041,this morning this afternoon i suffered much pain from my water but got relief and felt,D&C 18:11,0.2720582509201145
12036,in concert the articles of fai i then spoke on my early history for mints prest,D&C 33:14,0.27196174688195685
12015,by a horse waggon driven by a drunken man she fell between the horses did not,Alma 55:14,0.2717871720593875
12007,impressed wi the principles of the eternal truths of the dealings of the dealings of god,Alma 50:19,0.2716825770413748
12007,their word s were true i again ask what promise or protection have those vast millions,Ether 15:2,0.2716308421374066
12010,different meetings recd a letter from amp went home at pm thur drove to the office,D&C 20:44,0.27138186831951244
12024,the conference amp view the works which we promised to do i requested bro nuttall to,1 Ne. 18:23,0.2712886892051804
12061,drove to the stand erected near the b y monument where most of the ceremonies of,Ether 7:6,0.2711962340110903
12069,spent the day at the office i was visited by a russian prince by the name,3 Ne. 27:5,0.2706963817037521
12030,sent a letter to day to wi one from to him a great deal said about,D&C 111:6,0.27068927268324927
12024,for the east this morning bro came up from amp reported the work being done there,Alma 56:41,0.27058494197810573
12055,which are fine from the scenery is grand sublime we went to bed at o clock,D&C 129:9,0.2704815790157233
12007,to enable them to escape those tremendious judg ments which god has proclaimed shall come to,D&C 66:5,0.27041795556707565
12027,was a schoolmate of the late president and he is now returning from a visit to,D&C 102:9,0.27040193947288177
12022,me at nights which he will do went to the office and attended to my duties,D&C 123:14,0.2703168323497564
12069,dozen rabbits we then returned home i spent the day at home resting amp reading i,3 Ne. 21:28,0.27026103619037944
12023,my railway passes so i could not find them today i remained at home to day,2 Ne. 2:22,0.27024654876696913
12018,of water ain the west had an interview wi senator brother blank amp a mr green,3 Ne. 11:26,0.2699575875173627
12028,which he has been writing he staid till pm bro came to my house and examined,Jacob 7:27,0.26991934752200575
12040,the office men are tied up in this city through the strike several of them visited,D&C 76:73,0.26990012491731236
12016,from libby i am quite unwell figure i held a meeting at my house for the,1 Ne. 20:12,0.2697900222902152
12044,i talked wi bro confidentially in regard to some of my personal affairs for a short,D&C 76:100,0.26975916390738197
12015,utah company in the afternoon i met wi the twelve at the and had prayers amp,D&C 18:27,0.26962073408412696
12042,at home wi the family mon st went to the office feeling fairly well able to,D&C 19:36,0.2694863342160932
12015,amp reading i attended a meeting on the wi the telephone company amp mr doty amp,D&C 123:14,0.2694778436223068
12046,the herds of buffalo for days amp nights amp c i slept hours from midnight to,Alma 36:16,0.26941472532940447
12032,mon i concluded that i would make a brief visit to to see my wife amp,D&C 42:49,0.26940786818037504
12070,at oclock amp bro at i drove to my dhter and blessed amp named her baby,Ether 4:9,0.2691197058407358
12057,telegraph from on our affiairs east some rain in the east cloudy i spent the day,D&C 44:1,0.26909109231848943
12037,i wrote a letter to owen amp sent him one from emma amp blanche i dined,Alma 54:4,0.2688301990471337
12029,called upon me at the for some minuts amp spoke upon our business i spent the,D&C 76:100,0.2687285982819703
12013,sirvices amp so told him amp said he could attend to his previous labors and i,Alma 11:33,0.2686429739288253
12058,i mailed a letter to from her father amp i wrote to amp i met wi,Omni 1:9,0.2685559437859805
12021,mother amp blanch i met wi bro about his mothers debts wi met wi upon silk,D&C 104:78,0.268312643225667
12071,well had a good night wrote to m mountford i gave bro one of my large,Omni 1:9,0.26812018670414206
12027,for me i did not go to the office today ihave been at home all day,D&C 64:23,0.2679834856444116
12039,figure i received letters from president amp prayed in the afternoon william whitaker taylor wm w,3 Ne. 19:32,0.2678795007724349
12057,home choreing i attended the quarterly conference at the bishop spoke first followed by john henry,D&C 72:7,0.26765570045372356
12034,w woodruff figure i spent the day in the office i wrote a letter to sent,Omni 1:9,0.26759693619557273
12017,investigations pertaining thereto i also had some conversation wi prests amp bro amp nuttall in regard,D&C 76:100,0.26756749129496976
12058,wi concerning some of our affairs in we had meeting wi several individuals among the rest,D&C 76:100,0.2675397274958499
12055,drank of the water strong of soda there are other such springs further down this section,D&C 58:34,0.2673996813268574
12016,ogden power company commenced at oclk amp closed at oclok i spent the day at the,3 Ne. 15:14,0.26727052837413934
12016,we met wi the brethren in the morning to transact business met wi mr bannington who,Alma 43:42,0.26708206002798657
12014,bro assisted me in looking over my bonds stocks notes amp c and andputting in good,D&C 20:57,0.26700156970875993
12018,rode to stoped at brother mils in the afternoon we rode to bishop amp visited his,D&C 107:68,0.26687016438699734
12070,amp c returned home at ate supper wi the family on going to bed i was,1 Ne. 1:7,0.2666835856312618
12014,assisted me in searching for two of my missing journals which he found amp made me,Mosiah 20:6,0.2666146533498102
12058,on business i visited wi my councillors at the which was being repard i met in,Morm. 1:15,0.2665544044048517
12021,carriages this morning and rode to on the way we stoped a short time to speak,Alma 56:41,0.2664946794113878
12013,of the directors of z c m i and this afternoon a meeting of the ogden,Alma 27:16,0.26627698765464286
12070,the folks got out amp picked wild flowers met bros amp who were out for a,1 Ne. 5:15,0.26626585623261023
12034,and the company owning the mine were also arming to defend it amp danger of blood,3 Ne. 12:22,0.2657720928654758
12035,out arose at shoshone changed sleeping cars at glenn s ferry to car messina had breakfast,Alma 19:33,0.2657475059546182
12033,her people by dr talmage st prest w passed his st anniversary quietly at home wi,D&C 60:8,0.26570260323554173
12056,and while i endeavoured to sleep had distressing dreams so that i was quite tired in,Mosiah 24:19,0.2655851694076879
12049,the church amp council was given upon many subjects i was quite unwell i spent the,D&C 102:2,0.2655758664925043
12014,pm wed i drove to the office feeling well and attended to the usual routine business,D&C 123:14,0.2654971711867541
12036,amp others drove to other parts of the land prest smi amp wife amp bros nicholson,3 Ne. 16:1,0.2654710000518297
12061,staid wi me tonight st i had a good night and wi my wife amp family,2 Ne. 5:6,0.26536143313538846
12012,holding in their hands sharp sickles and crying unto god dday amp night saying let us,D&C 39:19,0.26486254672976767
12038,asked that her cousin be released from his missionary labors in i took the name i,D&C 84:101,0.26476907343277134
12041,sing god moves in a mysterious way after which bro prayed i then asked the brethren,3 Ne. 19:32,0.2645315852701079
12068,to sea along the coast sou to sapoint san pedro the cliff house golden gate amp,Hel. 3:8,0.26449886031957665
12006,meeting in the brother a missionary returned from spoke minuts m amp m i went to,D&C 29:10,0.2643363092493546
12008,home reading figures i received letters from he said he had been removed to the capital,Hel. 1:27,0.2642246957367217
12037,the day at the office attending to business figures i received letters from to father amp,3 Ne. 28:40,0.2639276287901003
12053,in the house resting figure i received letters from to amp from owen figure i held,D&C 124:60,0.2638000117576615
12039,several days amp administered to me figure received letter from got likenesses of him owen had,Alma 17:18,0.26355779926422856
12024,office sat at home all day i met bro this afternoon amp had some talk wi,D&C 76:100,0.2634832901406449
12068,and started for at am foggy as soon as we got outside the golden gate the,D&C 22:4,0.2633134859748023
12059,noble men ordaind into the quorum of seventies has presided over the sabba school children for,D&C 58:10,0.2631660837552747
12013,to fares amp c st had a fairly good night i got out my monthly allowance,D&C 1:31,0.26314851746264983
12023,sent for elder this evening and requested him to stay wi me as i am so,Mosiah 13:3,0.26306041429257276
12011,told bro this morning that as i was now feeling so well and his office work,D&C 19:28,0.2626375152010041
12005,home this morning from the irrigation congress in we met wi brother from amp an interview,Alma 56:41,0.2623561241734836
12061,i had prepared a prayer but not being able to deliver it bro did so for,D&C 59:14,0.2622596141263786
12031,and again this evening until oclock elder came early amp staid till a m recd my,D&C 54:10,0.26211931947638595
12060,drove to the office amp wrote to m mountford i am not feeling very well some,D&C 76:100,0.2611780826191739
12043,we have had a hard rain amp cleared off to day a st louis paper published,Mosiah 15:14,0.2611438911027427
12020,will build a house this summer i left home for the office at attended to my,D&C 95:11,0.2610562245246727
12069,petersburg also rev we finally granted the prince the privilege of visiting the figure i received,D&C 27:11,0.2610322183068423
12065,i had a vary bad night i met wi judge amp about the ogden power company,Jacob 5:66,0.26095212596222445
12071,went to the office feeling some better did not have a good night i attended a,D&C 76:100,0.26095180549052566
12009,i went up to the office and talked much in regard to alice wi the brethren,2 Ne. 23:17,0.26077278217949473
12044,at amp had dinner having crossed the about a mile we are now in passed through,3 Ne. 12:41,0.2607290250159096
12038,went to the office amp attended to some personal writing wi bro nuttall amp also met,D&C 76:100,0.2604929402669194
12040,united states i spent the day in the house reading figure i spent the day in,D&C 138:25,0.2603942512522076
12029,city wi our faces badly burned by the sun we were quite weary distance mils i,Hel. 5:23,0.26028865195988876
12021,held a meeting wi the people in the meeting house w woodruff read the chapter of,Alma 27:16,0.2602051776405677
12021,to several hundred children who were paraded in the street as we passed at willard we,2 Ne. 8:23,0.26019976959887364
12021,much of the spirit of god rested upon us in our meeting last evening we took,Alma 58:10,0.260171430188036
12041,well nor take much nourishment during the night this morning after consultation it was ided that,D&C 112:5,0.26005946341690206
12029,bass lb amp a brother cht being all that the company cht we returned to the,Ether 1:34,0.2598512655446585
12028,been unwell at home wi a carbuncle on his neck i attended the meeting of the,D&C 123:14,0.2597558917088842
12006,also brought up and a motion made to try to get it back i had an,Alma 49:21,0.25975437011714314
12055,mills amp c to where we strike the thence down the river to mt shasta the,Hel. 5:20,0.2596988371930617
12036,then spoke again for mnts bro offered the benediction we took dinner at bro i afterwards,D&C 59:11,0.2596950494530267
12052,had a poor night do not feel very well sat up a little to day bro,3 Ne. 1:8,0.25952901404954765
12052,night i dressed this morning and drove up to the office this afternoon and staid about,D&C 112:5,0.2595259043618271
12028,of having had a dream to that effect i told them i did not administer to,Alma 19:34,0.25944735651208684
12005,amp wi their children left our house for this morning having been visiting wi us for,1 Ne. 13:33,0.2592891163472732
12036,done the team held amp bro pratt got t ook myself amp emma to his home,D&C 52:26,0.2591909247381725
12060,well this morning my bowels are somewhat costive amp my water troubles me i attended my,3 Ne. 17:6,0.2590263649893638
12038,called and asked permission to leave wagons in my yard for a day or two i,D&C 124:73,0.2589852361855328
12006,have ever been in the lake it was near midnight when we got home i attended,Mosiah 19:5,0.2586123171086522
12049,maps amp talking upon the con templated railway in the afternoon i met wi the apostles,D&C 63:52,0.258592617124972
12009,blank lines rd i spent a good night so did and the whole family for we,Mosiah 9:18,0.25846850719454956
12029,we drove sou on the shore of there found half a dozen boats and all the,Mosiah 7:22,0.2584246711063831
12067,spent one mission in england of some two years he is now laboring in salt lake,D&C 76:100,0.25839824541292944
12036,amp nuttall also put up at bp pratts i was very tired nd arose feeling somewhat,1 Ne. 8:31,0.2580224634779295
12012,the question for you wherever the eternal everlasting and holy priesthood or its influence dwells there,Alma 18:30,0.25793941096699785
12042,best to write my views and feelings on the matter which has been on my mind,D&C 128:1,0.2578889544048344
12046,home about midnight i slept some hours before a m had breakfast at am amp walked,D&C 76:100,0.2577133658682294
12041,son anointed pres smi mou assisted by bro amp l john nuttall bro by my request,D&C 20:57,0.2576635351919441
12013,would get along i went to the office and attended to business and returned in the,D&C 123:14,0.2575831462377305
12044,we spent our time in regiding andon the street cars and walking some as i seemed,D&C 76:100,0.25757044959829534
12040,the old folks on their excursion to we had a vary interesting day they spent the,Alma 31:12,0.25750029278164294
12044,arrived at at am and drove to the imperial hotel amp took rooms in assumed names,D&C 85:5,0.2573802117553226
12051,amp so did bro sat staid at home to day sun i spent the day at,D&C 52:44,0.25732646806540893
12010,tues i had a good night amp feel well this morning amp drove to the office,D&C 112:5,0.25706902403081433
12052,mind but concluded to wait until after the jubilee amp then express myself my wife dr,Alma 36:4,0.25670105765566287
12068,by the other route had a carrige ride in the golden gate park in its cultivated,D&C 88:61,0.2561869511072023
12014,several liverpool office drafts and went home at sat ap staid at home today amp rested,D&C 19:36,0.25611923784807017
12005,a copper box we got a lease of the from today figure day we had published,Mosiah 15:14,0.2559710663485287
12071,at p m wed went to the office feeling well and was quite busy all day,1 Ne. 8:31,0.2557953441905844
12043,the day in the office i signed for the liberty bell i met wi the board,D&C 107:68,0.25559668318292816
12041,i pspent the day at home rode out for an hour this evening amp sat out,D&C 39:21,0.25552708370976396
12037,were made untill midnight m i returned to amp spent the day at home i spent,Mosiah 2:16,0.255488391737211
12049,of company col amp called upon us in the evening gave us an invitation to go,Alma 56:46,0.25537616529358126
12029,day in the office was taken sick wi severe cold upon the lungs,D&C 84:68,0.2549343194438995
12008,wi about joining in a new company throughout the united states upon the subject of a,D&C 87:3,0.25489320249960856
12043,quite cold nd i spent the day reading figures i received letters from to father amp,D&C 45:27,0.25479708792496103
12071,good care of himself he had all his sons wi him this morning i went home,D&C 124:113,0.2547697346836866
12043,secretary of labor party wanted to lecture we gave him the use of the first hard,D&C 63:62,0.25476288373685857
12022,strain myself in voiding my water thurs rd i do not feel very well this morning,D&C 129:5,0.2539965651219538
12028,for breakfast dressed amp went to the office at i attended to several matters which came,D&C 123:14,0.25392461965918134
12022,waited on me today as he has done every day before which has helped me recd,D&C 54:4,0.2539211510756013
12017,favorably he staid wi me tonight amp i attended the meeting this afternoon and spoke minutes,D&C 123:14,0.2538906139481837
12051,home reading amp wi my family i drove to the office feeling much better in my,D&C 19:36,0.2537745878729517
12040,amp burned near dollars wor of property the us armey at went by call to ogden,1 Ne. 3:25,0.2537737941520253
12046,wait on her did not sleep much before midnight as i had been taking some opening,D&C 76:100,0.2537333155279677
12060,mon at the office all day attended to the business pres returned from the east today,D&C 123:14,0.2536553788262765
12035,rested better but did not sleep much as is always the case on my first night,Mosiah 29:12,0.25354092501497594
12007,as have these my councillers amp the apostles and i feel impressed to make a laration,D&C 84:63,0.25350938971139825
12006,all written wi a pen amp nicely framed which was nicely got up i paid maunch,Alma 13:15,0.2532167892814894
12011,the presidency and apostles at the and felt well whilst wi the brethren afterwards at the,D&C 94:3,0.25297982614210257
12020,out in the afternoon amp spent the evening wi the family slept about hours before midnight,3 Ne. 8:19,0.25297556697631174
12024,to see him which he did i attended my usual meeting at the at am afterwards,D&C 123:14,0.2528270348397367
