internal_id,text,verse,probability
12076,into the mountains where i staid wi some of the brethren who were herding sheep some,D&C 76:100,0.6003438328501676
12111,office of the first presidency of the church of jesus christ of latter day saints p,D&C 115:4,0.5999788730391464
12076,of the book of mormon from bro franklin jenne cannon frank j cannon at which to,Morm. 1:1,0.5919145858434709
12255,money to pay the debts i met wi the board of z c mi in the,D&C 104:78,0.5326297025344531
12108,i mailed letters one to from father amp amp one to from mother amp father kheber,D&C 93:3,0.5235574709059472
12081,figure born died aged years m days y ross died to day at oclok died suddenly,Jacob 1:12,0.5214172973724563
12076,amp their wives and my dhters amp their husbands to meet wi me this evening at,Jacob 3:7,0.5213199414909443
12203,discused in one of his sermons about the apostles not having the gift of the holy,Alma 9:21,0.5126614103173674
12116,amp prayer by the prayer at the grave by pr esiden t geo q cannon mon,D&C 59:14,0.49316130068980146
12197,mints i followed for mits read from isaiah sang how beautiful upon the mountains amp c,Mosiah 15:15,0.4880781792922114
12072,the mortgage bros cannon amp smi also to syn as the first presidency bro called and,D&C 94:3,0.4860873999173452
12075,bank business i had a bad night night last night was quite unwell to day ndconcluded,Hel. 14:4,0.4771125483747116
12079,ba and slept some before midnight i slept fairly well until am restless some of the,D&C 76:100,0.4763458741125605
12203,published in the herald amp tribune presidents denial of the slanders in the times was published,Mosiah 15:14,0.46297687192367726
12076,were present myself and wife amp wife and wife amp amp amp my grandson of ashaels,1 Ne. 16:7,0.46277443159398585
12083,after midnight i arranged wi bro to bring madam at pm wi whom i had some,D&C 76:100,0.4583875327451456
12087,that time i had asked bro to come and read it because he had read it,Mosiah 25:5,0.4566105107816827
12167,tithing of the family i went to the office and to the wi the twelve we,D&C 119:3,0.4503070164524213
12208,the office being quite busy tues at the office busy most of the day in the,D&C 107:68,0.4482675564897868
12173,covenants you have entered into i will promise you that you will be true and faithful,D&C 108:5,0.4472381580240846
12203,her amp sent her i met wi the twelve in the i had an interview wi,D&C 84:101,0.43584043370246234
12163,before riturning home amp did not leave untill pm i attended a family birthday gathering at,D&C 19:36,0.4313188677355246
12236,through my system i was quite sick at night i was allso sick throug quite poorly,D&C 84:68,0.42936229702409473
12086,is also at owens very sick the sounded his lungs and pronounce him a very sick,D&C 84:68,0.4256223090724062
12108,a game of foot ball which cost him his life it was a dangerous game figure,3 Ne. 4:2,0.4237786502443022
12177,thronged the streets on the way from east to thsou then to state nor to sou,Hel. 1:31,0.42064793499594133
12072,evening to see the fireworks could not get near enough wi carriage to see them so,D&C 42:49,0.41949891308735926
12173,god yourselves and your parents through all time and keep the commandments of god and the,D&C 136:21,0.4186842594839945
12090,our outing until some of the children climbed the hillside amp in coming down two of,D&C 76:100,0.41782906047731816
12112,how he is doing after the accident to his eye the dr feels that he can,Jacob 2:15,0.4142353290215385
12167,thatcher amp others to ordain a high priest then set him apart for a bishop i,D&C 68:22,0.4140866143195494
12255,to pay the debts upon it a committee was appointed to see if they could borrow,D&C 104:78,0.4134230887841788
12145,build meeting houses in that countrymission pres geo q cannon said this committee will travel through,D&C 94:15,0.4127366876473825
12073,saying that was about to be sued for a note of on a harness i attended,D&C 123:14,0.4124267756356077
12244,a letter from gen figure i mailed letters to to day from father amp,D&C 44:1,0.4123798884181444
12216,office i received letters figure from one to father amp amp one to amp had one,Mosiah 18:21,0.41130031076042034
12109,some for amp while she was here we hung up all the frames she has brought,D&C 132:42,0.4054495081634612
12084,my wife and dhters and and and my granddhter i had a bad night did not,Jacob 5:66,0.4054462097098966
12146,elected as or of and out of of the council elected are members of the church,Alma 31:17,0.40440783779990636
12089,dispatches of today that the zcar czar of died at oclok to day figure the czar,Jacob 1:12,0.4041624786464861
12103,bros andrew smi andrew smi amp his son to to build a porch on house we,D&C 109:5,0.4031722292272293
12097,come upon cities towns and villages in the midst of this great wilderness of trees we,Morm. 4:22,0.40154223837402436
12184,wi my wife pres amp wife elders amp also bro charles hardy chas m hardy engineer,1 Ne. 16:7,0.40146792376520707
12119,amp son amp his son amp his son making four generations all of the name of,Alma 63:17,0.40062082635938506
12177,temple thence west to east temple nor round the to nor temple gate at a m,2 Ne. 5:16,0.40030224534703895
12244,at the house which was then taken to the and exhibited to the people for hours,3 Ne. 8:19,0.3995283033471402
12145,q cannon explained as to the power co not one dollar of church funds had been,D&C 72:10,0.3989951507638585
12103,afternoon this being the day set apart for the presidents of stakes amp bishops amp counselors,D&C 68:14,0.39777551434055336
12132,choir amp congregation sang we thank thee o god for a prophet prest geo q cannon,Alma 31:18,0.3975991783834888
12153,called up whare he had preached in a political discourse concerning brother it was represented that,Alma 43:2,0.3946816040348133
12236,through the day some better at nigh i went to the office amp spent the day,D&C 43:17,0.39445501482702017
12087,in it were now transpiring amp coming to pass in our day many of the things,D&C 63:53,0.3939959921406582
12093,at pm this is elder leonard john nuttall l john nuttalls birthday anniversary amp he went,D&C 93:6,0.39315974835342327
12216,variety of feelings towards us some of the democrats are are attrying in the east to,D&C 76:100,0.3931481647028803
12083,i accepted and requested him to inform bro watson that i accepted his bid amp for,D&C 72:18,0.3923630886664948
12173,are guided by these evil spirits die they go where they are and the evil spirits,D&C 50:2,0.3916192155409624
12084,the snake river idaho territory snake river and were in sight of the river a good,Alma 43:27,0.39035692250185655
12099,at pm prayer by pres spoke mints amp then presented the general authorities of the church,D&C 102:32,0.3902102114615049
12089,the sabba school which were vary good election in i went to our school house amp,D&C 97:3,0.3896361709034323
12153,weighed to day amp weighed lbs which is to much for heal i met at the,Alma 8:14,0.38916220762151366
12119,a good night slept most of the time went to the office staid till pm went,Ether 6:13,0.3888749140621238
12173,and there is where the devils do not dwell and therefore when you get there there,2 Ne. 9:25,0.38823036424575746
12153,brother thatcher had made a statement about brother merrill which was false amp brother thatcher now,Ether 9:8,0.38723518636743626
12087,office drafts for the office and other wise busy went home at pm,D&C 107:68,0.38615607388457335
12148,sea through the park i received letters from and tues to day i wrote letters to,Alma 54:15,0.38596233599185376
12255,i met wi quite a number of men i met wi amp and quite a number,Alma 44:21,0.384722752350258
12104,did not sleep well concluded not to go to the office this morning and sent word,Mosiah 24:19,0.3833693333807982
12098,by the croud and a great prosession in the city it was a great victory for,Alma 57:22,0.38304201837660756
12123,cannon mints prest mnsts pres geo q cannon reported the labors of the twelve and first,1 Ne. 12:9,0.3825166299929119
12104,the general church board of education this afternoon i went home at pm wed i did,D&C 128:4,0.3821064072002086
12208,gentlemen called on us today they are a delegation of the hawaian people on their way,Hel. 1:31,0.3815616163744065
12097,stopped at this hotel i wrote a pencil letter to and wrote too we spent the,Omni 1:9,0.38122538694450786
12125,amp elder took good care of us attended the conference meeting and at attended the funeral,D&C 123:14,0.3802175895859386
12203,in bo herald amp tribune i met wi the twelve in the the drins of was,1 Ne. 12:9,0.3783860923171123
12072,them bro stayed wi me all night i spent a good night slept nearly all the,Ether 15:20,0.37641003568579234
12173,and there are plenty of them in the midst of the latter day saints as to,D&C 115:4,0.37598529182328466
12146,my desk tues nd this is the election day tickets in the field i went to,D&C 88:51,0.3758643626893499
12098,to day to pay some on church matters as the presidency of the church we did,D&C 51:11,0.37575516503934603
12112,the interest on deposits from to bros amp accompanied me to my son residence to see,D&C 58:24,0.37561316099449044
12077,several hotels stories high built on piles the residence part is on the land freight was,D&C 58:24,0.37535613189894407
12120,wi us to and saw that our transportation amp pullman berths were all nicely arranged sun,Alma 58:10,0.37509589958321604
12236,president died this afternoon at oclok at figure born died at oclock aged years one mon,Jacob 1:12,0.37475850533724303
12120,quite a leng of time at on our arrival at we were met by col amp,Alma 56:23,0.3747392645041204
12104,and went home at p m having a slight cold fri my cold is troubling me,D&C 45:27,0.37370073683520155
12160,have a very good night last night at oclock pres amp elder amp others accompanied me,Hel. 14:4,0.373171629925397
12117,pm fri m i had a bad night again wi my throat until i applied the,Jacob 5:66,0.3731386150219188
12226,workers in the temple amp others it included the presidency of the church the twelve apostles,1 Ne. 14:20,0.3730049042529415
12236,i was quite sick last night amp sick to day i took cold which settled all,D&C 84:68,0.37213150035061826
12142,a letter from prest figure i signed a note to day as trustee in trust for,D&C 20:84,0.37199892933443546
12226,seventies and the leading men of the blank wi many of the aged men amp women,Alma 30:18,0.3715704018525139
12145,spoke on tithing amp care of produce amp c bros crain h smi george w mccune,D&C 119:3,0.37122647206925297
12127,have conjestion of the brain i also sent for my dhter who came to wait on,2 Ne. 6:13,0.36965922018197006
12116,at my desk went home at pm wed at the office today thurs busy at the,Ether 4:9,0.3691688219910382
12203,the office answered the libelious document in the n y times against him amp the presidency,D&C 94:3,0.3691337187273893
12208,at home to day i spent the day at home wi the family mon drove to,D&C 19:36,0.36905200706066443
12133,had some conversation wi the executive committee of z s b amp t co and in,D&C 76:100,0.36904636678060687
12129,it rained so we did not go and returned to our stopping place i received an,Mosiah 9:18,0.36869072524556157
12173,covenant and promises have been made to you for time and eternity now if you honor,D&C 3:5,0.36862827842786833
12087,and remember these things but it was not for them to mention them or speak of,D&C 84:73,0.3683253785360522
12163,last for publication i received a card from from m mountford went home at pm thur,D&C 88:59,0.368115073599325
12099,amp min ben ediction by went to the office for lunch pm prayer by spoke min,D&C 29:10,0.36807417121134833
12127,times as i did not rest well last night i did not go to the office,1 Ne. 10:19,0.3677742726037236
12135,called on the amp wi a hard cracked catheter lacerated my flesh and enterence to the,Mosiah 15:2,0.36769505572977396
12184,wed i was at the office this morning did not sleep well after i got to,Mosiah 24:19,0.3673318150932477
12103,all well thurs at bro is at work on the porch fri nd at we are,Ether 4:9,0.3673117621724743
12094,to the office am feeling fairly well quite busy until pm amp went home bishop after,D&C 107:68,0.36688139065777914
12081,west cornor of my lot i spent the day in the office had a bad spell,D&C 104:28,0.3664554813738221
12083,a bid from bro to do the whole job amp furnish material for in tithing office,D&C 121:10,0.36522070208851104
12173,true and faithful here you will be true and faithful there throughout all eternity here is,D&C 71:11,0.36494085137873344
12153,slept but little during the night i have not slept well of late nights i was,Ether 15:20,0.3643595860280112
12145,monument purchase of land in amp c prest jos f smi spoke on the brigham young,D&C 124:127,0.36422664108095704
12076,my experience among the people of amp c in the united order and of my going,D&C 104:21,0.3629058160107947
12085,in the called in the afternoon exhibited to us quite a collection of view of his,D&C 5:13,0.3625901214573957
12163,the residence of bro this evening until pmoclock tues ap i went to the office had,D&C 58:24,0.3622221294608235
12075,the twelve the apostles dedicated a bottle of oil from palestine then anointed me amp blessed,1 Ne. 14:20,0.36213549600974915
12173,us and have the power to tempt us and here is the place where they work,D&C 101:28,0.36198649590135146
12160,forward knocking her head against the wall and cut her forehead i amp bro administered to,D&C 84:101,0.36150795543791875
12077,it was somewhat expensive to go to amp and as i felt desirous to be at,Alma 62:28,0.36130985809624927
12120,i did not sleep much during the past night and cannot sleep to day we stopped,Mosiah 24:19,0.36058435475686756
12085,of the church and republicans who are presidents amp bishops are made to say in their,D&C 107:75,0.35871767795914566
12104,received a letter from from constantinople also a birthday card very busy all day in meetings,D&C 20:44,0.35871355044101755
12093,well this morning and drove to the office and was quite busy all morning prest came,D&C 112:5,0.3576101615910922
12167,the asylum i setled tithing to day for the family for as follows wilford woodruff total,D&C 136:13,0.3574837954084796
12094,snowed most all of the day fell some inches deep a little dhter of pres years,D&C 76:100,0.35744752586873463
12119,a beautiful bound copy of the book of mormon and bro will accompany it i spent,Morm. 1:1,0.356795964180273
12135,bladder but it hurt me and i dont think it done me any good wed i,D&C 84:71,0.35659785272200056
12184,had bro cash the check which i received from bro last we received a telegram from,D&C 76:74,0.35432663031131156
12085,to day wi one from amp we had an interview wi amp family went to the,D&C 31:2,0.35424899340330407
12119,a loan to bro which was done of went home at pm bro came amp staid,D&C 104:84,0.354138591729302
12082,pm and attended to a number of sealings and adoptions in my family and went home,D&C 19:36,0.35371258740808764
12103,the office attended the current business wed at the office this morning and arranged to take,D&C 107:68,0.35316484820639027
12133,drove to the r g w depot amp left on the am train i am feeling,D&C 110:4,0.3528192388014107
12086,office tues had a good nights rest and went to the office staid till pm amp,D&C 107:68,0.35201363757364096
12072,night but slept soundly from am to a m and felt better for it i do,Ether 15:20,0.3518799247691399
12087,spoken of in the revelation were attended to by president john taylor and the apostles at,D&C 102:9,0.35182026448746617
12082,a wedding supper of bro cannons dhter who was ried today pres cannon fcame from to,D&C 58:9,0.3493361696193642
12226,i thank god my heavenly father figure wilford woodruff born aged years this day figure b,D&C 136:13,0.34933091442356795
12099,by drove to the office for a short time amp then home tues drove to the,Mosiah 21:8,0.3487468813675804
12160,and went home at pm fri i had a good night went to the office my,Alma 51:33,0.3485084656454135
12160,the brethren accompanied the waterhouse bros to this afternoon i went to the office did not,D&C 107:68,0.34835365020905107
12081,car load of friends i visited the they filled a sack of lbs of sugar in,D&C 84:77,0.3480612823015316
12077,being built on the sou side of the river from astoria to the scenery is grand,Alma 43:41,0.3478897298582049
12098,sentative of congress instead of i met wi the twelve in the figure i met wi,2 Ne. 13:24,0.347886647038636
12116,all the brethren and was ordained an apostle pres geo q cannon being mou assisted by,D&C 20:2,0.3476111363650918
12129,saw many of the soldiers on parade i had a man by the name of blank,Alma 53:22,0.3475881490621345
12127,bro nuttall being mou she had another attack called and we again administered to her he,Alma 19:30,0.34724220100585906
12092,geo teasdale pres jos f smi am prayer by elder hugh s sowans elder john w,D&C 21:11,0.34708260697570414
12083,and staid wi me tonight i could not sleep well before midnight i slept very well,D&C 19:28,0.34651977545716983
12075,father amp i wrote letters to day to owen amp we met wi john on the,Omni 1:9,0.34619995847340973
12084,take steamer at for mr millis called upon us fourabout transportation to it is quite hot,D&C 89:9,0.3461627129840443
12097,at this hotel miles we went on board of the steamer city of kingston for we,Alma 58:27,0.3458158100279029
12123,and mnts sang benediction by had lunch attended conference at p m sang prayer by sang,D&C 138:24,0.34484343610239143
12129,to come and dr me amp bro he rubbed us all over wi oil he said,Alma 18:27,0.3443908322846197
12073,utah company i had a meeting wi the presidency amp left in the night for the,D&C 94:3,0.34291047458461255
12109,had a fairly good night i requested bro to accompany the to my house this morning,Jacob 7:22,0.34280244339185406
12098,the board of land amp colinization brethern of the twelve we spent most of the day,1 Ne. 12:9,0.3425865027963305
12110,of the steamer which we will take to we paid him each for the company to,Alma 61:18,0.34236769226477903
12083,him to go on wi the work amp c bro nuttall staid wi me to night,Ether 15:21,0.34228981312472745
12104,my meeting at the at a m and was busy at the office during the afternoon,Ether 4:9,0.3422849181581696
12203,a great relief to us the brigham young board met in the morning and done a,D&C 124:127,0.34194784815691187
12079,time after breakfast i took a walk at bro called on me the first time he,D&C 130:4,0.34078777382624115
12103,having a good job done on the porch sat rd got porch amp some other outside,D&C 121:10,0.3405533828411285
12096,as to be ready to accompany mrs woodruff to in the morning mrs woodruff and the,D&C 136:13,0.3404816617779389
12167,i had a visit from many brethren the first presidency of the stake called upon me,D&C 94:3,0.34016366317396823
12117,camphor on it to my neck wed i went to the office had a bad time,Jacob 5:66,0.3399498962418689
12110,crossing the sound we had to put on our overcoats it commenced raining on our arrival,1 Ne. 3:22,0.3396432971556338
12160,william mcewan wm mcewan shall be ried on the inst the wedding reception notes were sent,D&C 55:1,0.33963373263880686
12090,amp wife amp bro amp two teamsters in the afternoon amp came to us we enjoyed,1 Ne. 17:21,0.33882596071998566
12083,afternoon bro brought deeds for me to sign as trustee in trust one to corporation amp,Hel. 14:14,0.3384524827463687
12197,quayle cannon geo q cannon for mnts sang the spirit of god benediction by pres geo,D&C 138:24,0.33832777063908287
12135,board the yacht a and rode miles in hours it was about the finest sea side,3 Ne. 8:19,0.3382739586502993
12085,morning we were glad to meet we went to the figures i sent a letter to,Alma 56:41,0.3375467892519949
12084,rd at my request prests and smi are to accompany me to the coast at home,Mosiah 28:8,0.3372132063852167
12072,the parade seated in a carriage wi pres amp apostle at the head of the pioneers,D&C 28:6,0.3370217016583405
12173,will still have power over them while they will have no power over faithful saints who,D&C 70:17,0.3368791602873761
12087,twelve apostles i called on to pray which he did bro nuttall then bore testimony to,3 Ne. 19:26,0.33668083052528625
12087,after which i made some more reks by way of explanation and requested all to try,D&C 50:18,0.33632144314778495
12142,morning bo to father amp i mailed a letter to owen this morning containing letters from,D&C 112:5,0.33624467254637463
12167,ided that was wrong no man had a right to officiate in any office of the,D&C 107:9,0.3362405458412783
12073,to day the news published my card as well as the tribun i met wi judge,D&C 19:28,0.33608486668842796
12125,casket the choir sang prayer by b goddard sang elder prest amp prest amp myself were,D&C 138:24,0.3359764871012571
12072,morning pres called this afternoon amp staid nearly an hour in conver sation bro also called,Alma 23:17,0.33562720014756126
12094,the afterwards at the office met a mr from who was accompanied by pres he is,D&C 76:74,0.33551251671352805
12104,the the qchoir sang o my father prayer by bp a club of singers sang not,D&C 138:24,0.33490559636375405
12189,judge m amp as a parting hour they enquired if the trustees in trust controlls the,Alma 7:6,0.3347567267710784
12146,rest mon at the office today rec eived a letter from madam from tues california mr,D&C 44:1,0.3340394210927754
12081,one minute which would make sacks in hours making tons in hours it was to much,3 Ne. 8:19,0.33365667403568106
12117,caring for myself went to the office feeling fairly well my throat is about well again,D&C 19:28,0.33346974708107396
12145,mins i talked mnts mnts bro sang the holy city sang benefr diction by drove home,D&C 138:24,0.3332458999756015
12160,in meetings went home at pm wed i had a better night last night slept well,Ether 15:20,0.33303785331940694
12119,he wrote to be sent to the amp of to accompany a beautiful box make of,Omni 1:9,0.333034700271833
12086,corrected a false report made by sister to sister daniels smoot of bro nuttalls statement of,D&C 42:90,0.3321933173312344
12255,see if we could do any thing to save the selling at auction the at provo,3 Ne. 15:14,0.33214155872995504
12082,holaday col called on me wi a carriage and we drove to and attended the of,D&C 123:14,0.3320654714166613
12125,amp answered same busy at my desk tues i drove to the office this morning amp,Alma 11:29,0.3319107669301634
12093,able for my daily labors went to the office until pm thur went to the office,D&C 107:68,0.33186506754667955
12099,mints mints amp pres min benediction by went to the office amp had lunch attended conference,D&C 123:14,0.33181423610425875
12083,him to see what it will cost he went to provo this afternoon bro staid wi,D&C 42:49,0.3312934431771984
12167,discussed several subjects among other things it had been the custom in by moses thatcher m,Alma 47:23,0.3311256126562959
12146,z s b amp t co at p m amp afterwards attended the funeral service of,Mosiah 2:16,0.33107092040525815
12118,letters onetwo from and one from owen had not yet started on his,Mosiah 7:3,0.3309069743077555
12072,name the said notes to be also signed by geo q cannon and i also signed,D&C 20:84,0.3307686159341041
12132,sang prayer by sang elder spoke minutes mints mints amp mnts sang benediction by had lunch,D&C 138:24,0.3304916580064996
12096,in the kanyon i slept well most of the night drove to the at am called,Ether 15:20,0.33048837271688103
12163,ap at the office i receivd a card from for mrs busy at my desk attended,D&C 123:14,0.33042717954748985
12133,well amp staid all night thur bro called for me wi buggy this morning amp we,D&C 112:5,0.32993691554986837
12108,amp stoped wi while amp clara attended the funeral of the of who was hurt in,D&C 123:14,0.32990562181968336
12118,and a half hours paid but did not get the wor of my money a rainy,D&C 56:10,0.32988698140302053
12236,some enemies from have published in new times that the mormon church is bankrupt this is,Mosiah 15:14,0.32986557780552767
12081,of amp spoke to her son ross i went to my lot in and picked out,D&C 104:28,0.3296178673088931
12197,by bro black sang we thank thee o god for a prophet the general amp stake,Alma 31:18,0.3291454569057724
12079,felt somewhat drowsy amp slept some during the morning elder brigham young jr b young called,D&C 124:127,0.3288775727535831
12117,went home at pm very tired bro returned from today his wife is very sick in,D&C 97:18,0.3283616223072264
12125,drove home sat at home until evening when i accompanied pres wi amp his wife to,3 Ne. 19:1,0.32783972114923143
12079,arose dressed took a walk and ate my breakfast i rested and slept some bro amp,Ether 15:26,0.32752004654976524
12145,meeting houses in the missionary field than send men who have corrupted themselves payment of tithing,D&C 119:3,0.3272958273145279
12119,onyx amp gotten up by the scandinavian brethren of as a present to the king amp,Alma 8:9,0.3271839350184523
12173,of us are surrounded by temptations because we are where devils dwell they are all around,D&C 76:68,0.3271752850996024
12079,well rd i slept much of the time from midnight till went to this morning i,Ether 6:13,0.32677893300143546
12087,to the president amp twelve years ago bro nuttall then at my request read the revelation,D&C 102:9,0.3266043537549407
12094,at the office amp went home at pm wed at the office very busy so that,D&C 107:68,0.3263277356953701
12087,ensued on the united order amp c oranges and apples were passed around and all partook,D&C 104:21,0.3260880217367689
12255,i also met at oclock at my office amp dusenbury from amp amp others from to,D&C 124:73,0.32590017251871806
12104,home from the mon st it snowed till pm i went to the office this morning,Ether 6:13,0.32589476500758274
12173,but there is no man or woman who has been true and faithful here until dea,D&C 124:85,0.3257095246722554
