internal_id,text,verse,probability
12160,her amp she felt better i also met wi bro this afternoon amp talked wi him,Alma 47:33,0.28561005171929826
12098,to mind i spent the day in the office the republicans had a great celebration in,Mosiah 21:10,0.2855586416470406
12165,reception of the body manager of the o s line amp mr clay of the u,D&C 88:15,0.2849501810954695
12079,for some time i retired early and slept very well nd i slept well and arose,Ether 15:20,0.28480797391479773
12226,orn aged years old this day we held a bir day party in the wi some,D&C 76:100,0.28472132516248894
12184,the new reservoir found the work progressing very favorably then drove to bp pratts at hinckley,Ether 13:9,0.28431675854237215
12083,talked wi him in regard to my genealogy which he is writing up bro nuttall came,1 Ne. 6:1,0.28410819364780737
12129,news prest got a telegram saying his dhter was quite bad wi apendicitis and was to,Jacob 5:66,0.2838686760826361
12184,all our party had breakfast at bro hotel his amp her making us very welcome amp,Alma 58:10,0.2838306671155268
12119,a good night slept very well by request bro wrote the letter to the king amp,Ether 15:20,0.2837559590982305
12086,am went home at pm sat nd spent the day at home,D&C 19:36,0.28374799101799963
12184,vehicles amp after breakfast we drove to the new cut and around by the dam to,Ether 13:9,0.2837450679281639
12077,shutes forrests of timber ion bo sides coming down to the rivers edge a railroad is,3 Ne. 19:10,0.28361086442151623
12133,a meeting of the executive committee of zcmi this morning also my temple meeting this afternoon,Alma 27:16,0.2835280886764631
12173,that will ever be disturbed or annoyed by them after dea for the reason that when,1 Ne. 8:3,0.2835238996331273
12095,i went to took supper then returned home i spent the day in the office i,D&C 58:11,0.2833215574827279
12146,the late sister wife of bro john clark at residence bro amp prests amp amp myself,D&C 58:24,0.2833012671755249
12085,travels in he gave me a peice of rock from adams altar politics are still boiling,1 Ne. 2:7,0.283133167779679
12208,z s b amp trust co at pm amp transacted the wcurrant business went home at,D&C 20:62,0.28310051097973443
12099,d telegram saying that my dhter died in yesterday of typhoid fever wed drove to the,Jacob 1:12,0.2829670403904166
12203,unwell at nigh we met wi brother amp wi others we had a meeting wi the,Alma 32:9,0.2829185793986671
12160,company directors also had an interview wi mr and of and had a nice visit my,D&C 88:54,0.2828438575471376
12120,behalf knowing my condition i told him as the arrangements were made and while i would,D&C 93:10,0.2827741711597485
12142,monthly it is said to be the best history in the world the twelve met in,D&C 107:23,0.2826057612653539
12089,of russia died at oclok this day of spent the day in the office we had,D&C 20:23,0.2825710857741821
12255,had a hard sonow storm last night i met wi the twelve in the for prayer,Alma 26:6,0.28230160936807525
12096,a missionary at jackson kentucky which i had bro nuttall answer i also had a letter,D&C 133:65,0.2822255822831921
12160,dhter called on me for assistance of to pay her taxes which caused me some trouble,Alma 42:29,0.2820565392505706
12129,be operated upon this will cause brother and sister return home sat dr called and spent,D&C 42:90,0.2819664845802288
12099,office this morning amp then to the at am attended the conference meeting prayer by spoke,D&C 123:14,0.2817610079850208
12104,the office we met wi govr amp party of for a short time i also attended,D&C 123:14,0.2814798419549517
12173,the riage ceremony on behalf of my dhter and my wife amp several of our friends,D&C 84:77,0.2813950983776582
12123,prest read the st section of the book of drine and covenants i then spoke for,2 Ne. 27:18,0.28129085909285223
12163,i feel well this morning attended the conference at am sang prayer by bro sang pres,D&C 138:24,0.2812112176850505
12189,wi the board of z c mi also met wi brother amp figure i sent a,Alma 43:42,0.28098901235616475
12081,for me to clime the stairs and go throug the factory the heat amp steam made,2 Ne. 14:6,0.2807547620949426
12146,behalf was busy wi them until pm when i went home quite tired sat i staid,1 Ne. 1:5,0.2807216367980184
12165,elder in inviting the party to go on the train also in making preparations for the,2 Ne. 16:1,0.28068363639810673
12189,letter to from his i met in the morning wi the utah company also met wi,Alma 51:29,0.2806417002009976
12119,queen on the anniversary of their coronation the box was shown to us yesterday afternoon also,Hel. 5:26,0.2802532400703727
12203,i met wi amp i also met wi brother i had due less money i was,Alma 51:29,0.2801267995064013
12076,days i was very busy reading the book of drine amp covenants on one night i,Hel. 14:4,0.2800473340219761
12236,i met wi zions savings bank board i wrote a figure letter to to day figures,Omni 1:9,0.2799000091852394
12116,at the office this morning attended a meeting of the stockholders of the deseret amp salt,3 Ne. 12:13,0.2798821105410396
12109,those of her native land jerusalem she wants to visit that country again amp talk to,Alma 19:29,0.2797194460150226
12146,not go to the cemetery but returned to the office and went home at pm rained,Mosiah 21:12,0.2796472165377257
12165,church left the city on the rio grande western train at am and arrived at in,Alma 56:15,0.27964377227940257
12184,comfortable pres ira noble hinckley ira n hinckley amp son also bp arrived wi teams amp,D&C 58:10,0.2791009749196712
12117,wi my throat last night could scarcly brea until i applied some fat bacon to my,D&C 76:100,0.2783460030964576
12079,very well i rested very well and slept considerable arose at a m shaved myself and,D&C 97:18,0.27815406010304883
12123,at a m at the choir sang prayer by elder sang elder spoke mints mnts mnts,D&C 138:24,0.27807202766084305
12109,to on the morning train i rode out this afternoon amp sat on the porch this,Hel. 1:31,0.278060294935098
12119,queen amp bro nuttall brought it to me so that i signed it amp he took,Alma 19:7,0.27805142987868064
12135,occupied a seat by the side of uncle i was the oldest man he next many,Alma 1:2,0.2780324564823484
12216,bir day i spent the day at home writing out invitations to our bir day party,3 Ne. 1:8,0.2780289086692465
12244,procession i ever saw in i think it was a mile long we took cars amp,3 Ne. 12:41,0.2778601473358503
12096,sacrament wi my counselors amp apostles bro came amp staid wi me to night mrs woodruff,D&C 124:142,0.27779566074698075
12203,financial board of the savings bank they offered to loan us thirty thousand dollars this is,D&C 104:84,0.2775444910163404
12165,p also offered a train prest and members of the twelve now in the viz amp,2 Ne. 16:1,0.2774452096612265
12129,in the morning the women went out riding on the cars amp i took the carriage,Alma 58:30,0.27741895492646196
12076,i went to the office did not sleep very good last night i requested my sons,Alma 51:33,0.2773881223275443
12112,at the office not quite so well have some rheumatizm very busy on financial matters sat,D&C 76:100,0.27723074962578276
12148,were visited by some friends in the evening brother and myself went out riding to the,D&C 76:100,0.27718078798377227
12142,the to settle some difficulty between amp it was not setled i spent the day in,D&C 76:100,0.27708566787389727
12077,tonight after lunch we rode out on the cars to portland heights and then through east,2 Ne. 24:14,0.27684703570460717
12184,bed amp have some head ache i attended a meeting of the power dam company also,D&C 76:100,0.27684266934976753
12244,we met wi the twelve in the and had prayers in company wi my wife i,D&C 18:27,0.27674104126121896
12097,salmon business bo in catching and canning we arrived at and stopped at the portland hotel,D&C 18:42,0.2762450759407931
12173,will be no one to tempt or lead astray and for that reason if you are,2 Ne. 17:12,0.27616718413898295
12226,returned home went to bed amp died on the of i have been a member in,1 Ne. 1:7,0.27616021074455605
12133,to his sons met us at depot amp drove me to found them all feeling fairly,Mosiah 21:8,0.27582539433975684
12117,speaking of my sore throat today dr suggested that i put some raw fat bacon wi,D&C 76:100,0.27575309558701067
12098,the republicans they met in the in the evening amp many speeches were made,Mosiah 7:7,0.27553118332463467
12133,fairly well was met at the depot by bro amp drove to the office i attended,D&C 123:14,0.2755174304673221
12216,day we had quite a number of letters to day from the east upon business matters,Mosiah 21:10,0.2753836834790208
12160,i went to the office today had a good night i met wi the ogden power,Alma 51:33,0.2752746098632488
12184,in our beds bros wilcken nuttall amp hardy at the hotel sat arose in good season,Alma 34:1,0.2752065721247261
12165,arranged for a special car kindly proferred by mr of the rio grande western railway amp,D&C 99:6,0.2751911328921725
12104,at home this morning and attended the funeral services of the late bishop at pm at,D&C 42:73,0.27515686523691135
12119,went home at pm had a fairly good night went to the office attended a special,Alma 51:33,0.2750423675713008
12197,to bro hales pres cannon amp elder nuttall attended the priesthood meeting this evening pres hinckley,D&C 123:14,0.27494138993394857
12160,office quite busy amp went home at pm we arranged for a car amp several of,D&C 20:81,0.2748348101457898
12083,amp experience in traveling as a lecturer for some hours which was very interesting to myself,D&C 76:100,0.27474819670870915
12096,left early in a buggy for i attended my temple meeting at and partook of the,1 Ne. 8:35,0.27468357466080173
12216,bir day party about in all prest read to us several letters from from showing the,Mosiah 25:5,0.2745475950827602
12089,the circle prayer we resolved to organize a geneological library in the our business is crouding,D&C 59:14,0.27429609193732646
12092,am prayer by elder j d t mcallister elder j d richards spoke min b young,D&C 21:11,0.2741249348296372
12132,for second attended conference at pm sang prayer by sang prest jos f smi read reports,D&C 138:24,0.273767078598688
12073,a meeting in the farmers ward in the evening for the benefit of a of brother,D&C 111:2,0.27314063950641665
12084,to day deg altitude am much better today being in a low altitude we had a,2 Ne. 27:23,0.27303035185187974
12076,children and the house maid i referred to my labors in some years ago and related,Alma 15:2,0.27233784215370554
12118,the steamer and we will have to wait nearly a week longer we are paying a,3 Ne. 3:21,0.27228034377736277
12145,expended in that sang benediction by bro went to the office amp had lunch at pm,D&C 138:24,0.2722747097752183
12084,p m for the nor to and at we spent several hours i am accompanied by,D&C 20:81,0.27210255610675027
12160,in pertaining to the palestine mission amp bro knight handed me a check for for that,D&C 71:3,0.27178584345067586
12123,i continued in meetings until pm amp went home wed i arose early amp after breakfast,D&C 20:44,0.2713658254390485
12119,zion was concluded this morning and the presidency of the stake expect to give their ision,D&C 94:3,0.27125819350345287
12120,for our trip to will accompany me sat very busy all morning and we drove to,Alma 56:41,0.27113935541531653
12095,men mutual improvement conference met at the at oclok i did not attend in the forenoon,D&C 30:4,0.27104965477337517
12075,in the hope of benefitting my heal left the office at one o clock today feeling,D&C 84:68,0.2709364251145474
12135,go there any more prest amp returned thur received a letter from and wi the name,D&C 44:1,0.2705960351866416
12184,to the young people i felt very well in meeting wi so many of my friends,D&C 84:77,0.2703351648580956
12142,pages figures i subscribed for a libary of chise litteraton of volums at a volume paid,Alma 13:15,0.27015208760552106
12163,attended conference at pm sang prayer sang elder spoke pres ident mints i followed for mints,D&C 138:24,0.2701278439013675
12132,first section of the book of drine amp covenants and i then spoke for minutes the,D&C 29:10,0.2700410221197792
12127,strange affair through the excitement i did not rest well on emma s arrival she took,D&C 132:54,0.2697361274843833
12178,wi the utah company and they gave us an account of their work in the east,D&C 70:4,0.2696252674206385
12103,at pm bro l john nuttall attends to me every day sat at home all day,D&C 34:8,0.2695767201039644
12177,presentable it could not be viewed by the people the family however took a look thereon,D&C 101:100,0.2695561308761614
12096,wi mr thos thorpe his friends from now paying him a visit madam called while i,D&C 84:77,0.26945467967409437
12094,morning drove to the office busy all day till amp went home sat staid at home,D&C 19:36,0.2694117931319596
12163,at the office this morning quite busy in meeting wi several of the brethren who called,D&C 20:81,0.26914001744058513
12093,feeling well and was kept quite busy all day went home at pm sat at home,D&C 19:36,0.26913200055024716
12098,the utah company on their business i met wi the board of education board of examiners,3 Ne. 4:25,0.26913031981671154
12133,did not sleep very well last night rec tel amp letter from at the office and,D&C 88:59,0.2688252216293182
12135,speeches were made in the club i was also called upon and made a speech which,D&C 93:10,0.26873467756877173
12090,in camp and felt well i went to be early amp slept soundly till midnight i,Ether 6:13,0.26837141013580923
12178,i met in the wi the twelve president being present a matter of was brought up,D&C 102:9,0.268229020178477
12255,fish culture six volums forest amp stream amp picturesque america the land we live in we,1 Ne. 3:15,0.26816794572198777
12109,i feel so much better bro came amp staid wi me to night we talked together,1 Ne. 17:6,0.2680005662140658
12117,have been in the office wi the presiding bishopric in the morning also met mr m,D&C 107:60,0.2679786916348599
12081,i spent the day evening of bro i went to the house amp saw the body,Alma 34:21,0.26790885825551825
12076,to accompany me home this afternoon after supper and at we met in the parlor there,D&C 58:9,0.2677751144498577
12133,answered it prest went to this morning went home at pm sat staid at home all,D&C 19:36,0.2677534766580499
12098,not get it all attended to i spent the day at the office i met wi,D&C 123:14,0.2675523362280314
12073,state government over penrose preached in the tabernacle to day i spent the day in the,3 Ne. 28:40,0.2674829475432249
12153,i went to the office figure from called upon me and asked me to fill a,D&C 102:4,0.26728472467366426
12119,to day and returned in the afternoon about oclock my dhter was taken suddenly ill while,D&C 36:8,0.26716381327279315
12178,night aged years m amp days figure ia spencer woodruff died aged years m amp days,D&C 121:31,0.2671128323544443
12103,home at p m wed at the office this morning prest amp accompanied me to this,3 Ne. 15:14,0.26702392990527907
12116,of a few reks i made yesterday at conference fri i was at the office to,D&C 72:7,0.2665849682165578
12071,the office pres still sick at does not go anywhere else went home at pm,D&C 124:71,0.2664560353845301
12112,programme amp returned on the pm train nd i have been quite at the office all,2 Ne. 16:1,0.2662774800181817
12116,temple abraham owen woodruff abraham owen woodruff was ordained an apostle i being mou assisted by,D&C 136:13,0.26578740567502934
12178,upon dr to visit her afterwards president amp accompanied me to wilfords house amp we all,D&C 76:74,0.26575603894717503
12097,arrived at about went to the tacoma hotel all together of course we spent the night,1 Ne. 3:23,0.2655434062401082
12077,p m the business part of this place is built on piles out from the shore,D&C 29:38,0.2655105511522095
12226,this is my bir day also my wife i am years of age amp emma is,D&C 25:1,0.2654223610906102
12099,rd at home this morning and wi my family during the day mon felt well this,D&C 19:36,0.26536440836841885
12189,administered to amp myself she is in quite poor heal at present cannon amp grant company,D&C 46:20,0.2653483108226188
12075,immensly during the past night i went to the office amp met wi president also amp,D&C 107:91,0.2650504327995913
12096,at the woodruff reunion to be held at spent the day at home rd bro came,3 Ne. 15:14,0.26504921197547715
12117,remained at home having a bad cold tues i went to the office i have been,2 Ne. 2:22,0.2649739237302367
12090,bed i slept comfortably till midnight i slept comfortably until oclock laid till dressed amp shaved,Ether 15:20,0.2647529455940572
12148,in there was quite a congregation all saints but two it was a very interesting meeting,Alma 27:16,0.2647219297362834
12120,that bro was also going and would attend to me he expressed his fears in my,Mosiah 23:28,0.26465473925060234
12081,minuts i then followed the body to the grave amp she was buried in the norh,Mosiah 23:30,0.2646081908539861
12226,years of age i am in the enjoyment of good heal amp sound mind for which,Morm. 1:15,0.2644963766892694
12076,me is a very valuable book i signed a release of a mortgage as president of,D&C 102:9,0.26446619315472236
12092,taylor spoke min m w merrill a h lund penediction by elder geo reynolds,D&C 29:10,0.26387725111400906
12120,to day thur at the office all day quite busy fri at home making our preparations,D&C 43:17,0.2638497229017867
12081,in the illegible called i spent the day in the office in company wi amp a,D&C 107:68,0.2636061432483654
12094,i could not eat my lunch till pm went home at pm bp is very low,Ether 6:13,0.2635351308956229
12177,to wed were occupied in endeavoring to make the face so it could be looked upon,3 Ne. 1:24,0.26337608437553595
12117,usual meeting wi the twelve at the afterwards at the office and left for home at,Ether 4:9,0.26332620428118975
12108,wi us amp myself went to the amp met gen cockren amp amp spent an hour,D&C 88:56,0.2629756494368092
12109,amp slept some during the day feeling better towards evening bro came amp staid wi me,Ether 15:20,0.2628861113815
12189,i spent the day at home fixing up my journal was quite sick at our house,D&C 84:68,0.2627726459557866
12075,me for my breathing i met mr mires also figures we received a letter from to,D&C 44:1,0.26252053418487864
12208,depot at which they did amp at we arrived amp drove home wed i did not,Mosiah 21:8,0.26243106231811597
12112,him bro nuttall anointed amp bro teasdale mou i handed his a little money and went,3 Ne. 19:31,0.26222797238016576
12109,p m this afternoon i released bro this morning from coming to wait on me as,2 Ne. 6:13,0.262129736534762
12076,feeling fairly well this morning busy as usual all day and left for home at pm,D&C 19:28,0.2620048808019829
12108,it has been vary costly in repairing up i came to the office at noon amp,1 Ne. 1:9,0.26170561035032375
12079,sister miles of called about am amp myself had a nice visit wi them bro called,1 Ne. 20:12,0.26165916808105966
12184,until noon then went home gotand got ready to go to this evening on the oclock,D&C 136:16,0.2614648178067908
12184,train to view the works on the deseret amp salt lake co dam amp attend the,3 Ne. 12:13,0.26143940095142226
12077,the ogden short line depot for us we met prest at the office who was,D&C 98:12,0.2613160314681067
12095,office president went sou to get some drafts signed i met the twelve in the amp,D&C 76:100,0.2611137924047672
12072,for each and a mortgage to secure the same these notes were afterwards sent to me,D&C 76:74,0.2610611362366295
12076,sat i staid at home all day reading and resting at home busy some of the,D&C 19:36,0.26104112060185364
12163,to the office feeling well wrote to i listened to the reading of my reks of,Mosiah 25:14,0.26081156575228553
12129,the evening wi us t st i spent the day in my room and wrote letters,Omni 1:9,0.26041024972477383
12119,to this morning for a few days amp is coming to stay wi me for a,D&C 1:5,0.2600254111037306
12178,amp discussed concerning his family affairs i called uppon wife she is dangerous sick i called,Alma 23:17,0.2599716131623825
12146,went home at pm fri i went to the office did not sleep very well last,Mosiah 20:7,0.25996910465716433
12082,the office and attended the routine business and went home at pm tues drove to the,Alma 3:23,0.2599245083605565
12094,went to the office busy all morning on a hearing of pres of cache stake on,Hel. 1:31,0.25983317012863955
12119,meeting of the directors of z s b amp t co at pm to consider making,D&C 45:73,0.2598207335897899
12082,temple work in the sealing of children next i went home at pm wed went to,Mosiah 20:7,0.2597606207626413
12104,not have a very good night but feeling fairly well this morning went to the office,D&C 112:5,0.25972542267035115
12099,min j w taylor min amp geo teasdale min benedicition by patriarch conference again at pm,D&C 28:10,0.25956968481339965
12087,and the apostles i said i wanted my family to hear it read as many things,1 Ne. 22:1,0.25954258962522797
12099,mits minutes benediction by priesthood meeting at pm tonight at which prayed amp bp spoke m,3 Ne. 19:32,0.2592446815875177
12112,a nice programme was rendered bro master of ceremonies i spoke at the close of the,D&C 29:10,0.25921414911517393
12208,pm thur nd at the office this morning i attended my usual meeting at the from,D&C 123:14,0.25884763147925344
12090,saw it pass again attended my meeting at the after which was at the office a,Ether 4:9,0.25876817774885646
12090,contest broke camp at and started for our homes all tired we had two meals while,Alma 57:28,0.2586357842036912
12129,this morning mother and child doing well thank god i got a telegram from giving the,D&C 59:7,0.25854250470339973
12123,and of the apostles present all except bro now in palestine the choir sang prayer by,D&C 52:9,0.2584869669470856
12096,directors of z bs b amp t co at pm till pm we then returned home,Mosiah 10:21,0.25845289316289183
12099,morning drove to the office thence to the and attended the semi annual conference of the,D&C 123:14,0.2584344674884607
12184,where over of our friends met and passed a pleasant evening in conver sation and congratulations,Alma 34:21,0.2581708842611668
12104,bp and prest each referring to the life and integrity of bp morris prest spoke very,D&C 29:10,0.25807004881308604
12135,me i rode to the coast amp saw the seals covering all the rocks sat i,1 Ne. 12:4,0.257832803697786
12081,reynolds spoke minuts edward stephenson edward stephenson spoke m amp george reynolds m amp w woodruff,D&C 29:10,0.25767304786127737
12083,amp family elder also came this evening and reported that he had examined house amp received,2 Ne. 5:6,0.2576681451771618
12244,miles the body of was laid out in his coffin made of locuse wood which brother,Ether 9:8,0.25745033505554005
12082,sat staid at home today sun at home all day amp rested myself mon went to,D&C 19:36,0.25720019289110185
12142,short time on company affairs figures i received letters from one on the amp one this,D&C 35:2,0.2570986194264618
12160,my water seems to come more naturally it has been ided that my dhter and bro,3 Ne. 11:26,0.2569870893293814
12148,and comments the word being so sudden and unlooked for nd the following telegram was received,D&C 93:8,0.256745205103998
12119,spent the day at home reading and resting bro came and staid wi me tonight had,Mosiah 25:14,0.2567402894525742
12127,george went out and around the place but did not see any body this was a,D&C 88:116,0.2567389965168756
12160,or three letters i am feeling fairly well to day i attended my meeting at the,D&C 123:14,0.25635292929276404
12208,this morning amp remained until pm sat staid at home to day recd letters from,2 Ne. 2:22,0.25621197934046075
12132,time feeling well in my heal at a m i attended the conference sang prayer by,D&C 84:68,0.2562054051737207
12127,of the house coming up behind miss who was standing there and put her hands on,Hel. 11:19,0.25615383840698736
12163,my father pres ident spoke mints sang amp benediction went to the office amp had lunch,D&C 29:10,0.25612225780318093
12077,very dry and dusty sat selpt slept well the past night arrived at at am as,Ether 15:20,0.2560474613268919
12082,at somewhat tired sat nd at home today i spent the day at home a general,D&C 30:4,0.25595681308670537
12153,office brother amp also brothr amp sister i spent the day at home not vary well,D&C 42:90,0.25577936603173207
12112,the morning and busy this afternoon until when i left for home tues drove to the,Mosiah 21:8,0.2557180882521856
12197,by bro russell sang god moves in a mysterious way pres spoke mits prst mnts prs,D&C 29:10,0.2555597129840945
12125,day at home at home all day weather stormy amp cold wi rain this evening mon,D&C 19:36,0.2554932715533088
12145,i met wi the twelve prest of stakes bps amp c at the assembly hall sang,D&C 107:37,0.2553411806617268
12096,again tomorrow bro nuttall came amp staid all night i received a letter from my son,D&C 44:1,0.2552784410023359
12083,one to mendon school trustees which i signed and acknowledged before bro nuttall as a notary,D&C 97:3,0.2552551769663077
12094,morning i drove to the office feeling fairly well attended my meeting at the at am,D&C 98:19,0.2552166731026435
12104,dead by but sleepe bro george benjamin wallace george wallace briefly addressed the meeting followed by,D&C 136:14,0.2551515067436402
12160,attended a meeting of the ogden power co also the big cottonwood power co at the,D&C 123:14,0.2548852692008082
12167,home reading amp writing figures i received a letter from amp wrote him a letter amp,D&C 44:1,0.2546774483874161
12098,amp presidents of colledges all gave their views upon the situation amp of the affairs of,Mosiah 1:15,0.25454088485143433
12226,also the leading bishops this is the last meeting president ever attended he was quite poorly,D&C 102:9,0.25438220875511336
