internal_id,text,verse,probability
12119,at the amp wrote to the trial of before the high council of the stake of,D&C 102:1,0.32570907909222174
12110,at we spent the day at the hotel we had an interview wi mr the owner,1 Ne. 18:23,0.3249671698869542
12099,president of seventies bros cowley amp woodruff each spoke accepting their appointment i also spoke for,D&C 29:10,0.32473386428649686
12117,throat when i got relief amp went to sleep i am better this morning have been,Mosiah 24:19,0.32437109072689885
12109,which are very pretty bro nuttall staid wi me tonight m mountford left on this evenings,D&C 97:18,0.3242976700963867
12244,smoot had raised himself had it sawed out amp seasoned and it made one of the,3 Ne. 26:15,0.32414174985332456
12119,few days i went to johnsons photograph gallery this afternoon and had group taken of myself,Mosiah 26:34,0.32397716487842326
12096,me as the veteran pioneer her sentiments were nicely expressed written in them she purposes calling,Alma 19:29,0.3239769425779216
12093,and wrote to her i attended wi prest amp the gathering of the island missionaries their,D&C 123:14,0.32393766168729005
12116,all the brethren there is much excitement in the to day in political circles in consequence,D&C 105:9,0.323372199858462
12094,snowed this afternoon and evening fri i am feeling well this morning had a good night,Alma 34:21,0.323205761326871
12132,sang prayer by sang prest spoke minutes mnts mints sang benediction by after meeting i went,D&C 138:24,0.3230360693383699
12094,ribs broken amp concussion of the brain phumonia is feared thur bishop morris died at this,D&C 107:88,0.3228225633126369
12208,gentlemen went home at pm and went to the tonight fri i drove to the office,Alma 3:23,0.3226117923964946
12244,finest caskets i ever saw in my life all the family took leave of the body,D&C 101:37,0.3223253262977495
12165,he slept peacefully all night and passed away without movement to prest fri rd prest directed,Ether 15:20,0.32201568697525806
12098,they had a great barbecue on the agricultural grounds oxen amp sheep were rosted amp eaten,3 Ne. 18:4,0.32188840375264977
12083,pay and in cash he also explained the nature of the desired improvements all of which,Mosiah 8:3,0.32177426089358296
12084,sleep we had traveled through dust all day we stopped a while at we agreed to,D&C 76:113,0.3216860178387073
12132,and attended the afternoon session of conference at oclock sang prayer by sang prest read the,D&C 138:24,0.321547115572043
12165,some twenty five members of pres woodruff s family and several other prominent members of the,D&C 42:70,0.3215067338369987
12142,for three years at about pe cent i met wi amp met wi the board of,Alma 43:42,0.3213177246042728
12255,young womons journal illustrated american years amp rout from to illustrated the higher officials vol vol,Mosiah 29:29,0.32126408064369333
12110,the hotel and the girls bought fur capes in the afternoon we took the cars and,D&C 101:56,0.321118268342966
12075,quite a large company in attendance remained untill after midnight i returned to to day mils,2 Ne. 2:22,0.3210778827847026
12072,a short time had a fairly good night sat up most of the day some of,D&C 76:100,0.3208253493835845
12096,to write up a biographical sketch of my past life to be forwarded to toand read,Mosiah 25:5,0.320578790805765
12236,busy day amp called upon me also col amp also figure i wrote a letter to,Omni 1:9,0.3202887708137296
12177,wilford woodruff died aged years the funeral ceremonies commenced at a m for full statement see,D&C 136:13,0.32021200290427293
12082,i shook hands wi some children i also went to pres residence wi this evening to,D&C 58:24,0.3201032250029493
12093,all day i spent the day at home at the office all day until pm i,D&C 34:8,0.3200046546768482
12083,public he staid wi me all night st i slept hours from pm to am and,Ether 15:20,0.3189654368336567
12073,over the meeting held in the on on the democrats are trying to break up the,D&C 49:12,0.3187435916839947
12145,the state amp try to raise sofunds for this purpose also spoke of the brigham young,D&C 124:127,0.31863454773501426
12073,house reading the tribun came out wi a card from me to day also the news,Mosiah 25:14,0.3183863146936233
12120,about our trip to as we did not expect to start until next i told him,Alma 57:30,0.31836299126555373
12173,continually working for our distruction and they do all they can against us when those who,Alma 61:7,0.31807692534282234
12089,figures i wrote letters to amp i met wi the apostles in the afternoon i attended,D&C 123:14,0.31787983917497087
12236,amp days i met wi the twelve in the and had prayer we also met wi,Alma 51:29,0.3176613057268952
12189,rd i met in the office wi my councillors brothers amp on some of our affairs,D&C 76:100,0.3176247663317978
12089,vary hard upon every hand money matters are crowding hard upon us we learn from the,1 Ne. 15:3,0.31743498151706245
12093,office amp left for home at p m at the office today feeling fairly well,D&C 107:68,0.31739317264452055
12184,where we were made quite comfortable in the afternoon we all drove to the farm known,2 Ne. 30:16,0.317230487319675
12173,the number of them i do not know but there are plenty of them they are,Mosiah 2:2,0.3172205825080992
12110,about my heart i am in danger of my life nd i spent the day in,3 Ne. 12:22,0.31707435782100696
12099,church at a m myself amp counselors also apostles amp were present prayer by a h,D&C 124:142,0.31706846509139236
12096,as director amp prest of the des tel co i spent a very good night slept,Ether 15:20,0.31685710809429335
12095,church as to day president has to explain in a card what he said at a,D&C 102:9,0.31652887950219666
12076,amp t co at p m and transacted the current business went home at pm thurs,D&C 20:62,0.31597976723453586
12076,after oclock afterwards at the office amp went home at oclock fri drove to the office,D&C 107:68,0.31574383933078504
12125,the directors of z s b amp t co at pm till pm then went home,Ether 6:13,0.31564439807156736
12173,throughout all eternity and i will tell you the reason why while here you and all,D&C 39:1,0.3155686679890123
12208,to pm i wrote to amp the letter was mailed col dickinson amp three other hawaian,Alma 54:15,0.31547431743143434
12073,all hell is stired up wi the whole democratic party against the church a terrible war,3 Ne. 8:6,0.3154573077919945
12120,my wishes that i would be glad if he was going wi me to which he,Hel. 13:7,0.3151287098212865
12129,the exhibition of the battle of manilla i never saw such fireworks in my life fri,Alma 28:2,0.3149132938543383
12177,were viewed by a great many of the family and friends and the authorities of the,3 Ne. 7:4,0.3148995206473869
12072,returned home the arrangement was very difficient and unsatisfactory to the thousands who went to see,D&C 42:49,0.31453099749967633
12090,delightful there were of the party myself amp wife amp amp children amp children bros amp,D&C 98:46,0.31390766856209396
12125,services the house was beautifully draped and a great profusion of flowers on and around the,D&C 42:73,0.31389396379948964
12077,at at am took a carriage and drove to the office bro had a carriage at,3 Ne. 15:14,0.3136742224379278
12109,as she wished to bring some more framed ferns amp c which tshe had prepared he,D&C 76:100,0.31349653359641494
12133,bro read to me bro nuttall accompanied me to the r g w train at pm,1 Ne. 22:1,0.31324170772486193
12077,arose at a m having slept well most of the night had breakfast at meacham harvesting,Ether 15:20,0.31273862247547224
12177,james woodruff jr amp the family followed and immediately after them the general authorities of the,D&C 102:32,0.3110246189180746
12177,clipping herewi ked the accompanying clippings are placed in this record to make the same as,1 Ne. 1:3,0.31097867141346963
12073,east wi the utah sugar bonds to deliver them to the men to whom sold i,2 Ne. 7:1,0.3108833585569174
12127,an unconsious condition i sent for dr who came and prescribed for her she appeared to,Alma 19:29,0.31081059309432274
12108,the mr congressman from we went through the as the repairs amp oration were nearly finished,Alma 43:14,0.3107662965070906
12083,me tonight st i slept fairly well during the night spent most of the day at,Ether 15:20,0.3102437705551198
12153,we granted the use of the for lecture of the charitable institution for the benefit of,D&C 59:18,0.31015211672342335
12255,forenoon i learned that the committee could not borrow any money for the things looked dark,2 Ne. 27:19,0.31012619022436233
12197,the car tues we left at am i did not sleep very well i had some,D&C 76:100,0.30999662109226417
12098,figures i sent a letter to from father amp the whole country is exercised about the,2 Ne. 23:5,0.3094712229401067
12097,night at all the company took cars and rode by the side of the river for,1 Ne. 2:6,0.3092806528591027
12093,was the orator of the day in the afternoon i went to amp met wi pres,2 Ne. 13:3,0.3092241106682925
12072,the meetings held yesterday and about obtaining from mr amp giving him notes for each and,D&C 46:3,0.3089612258243255
12072,for an hour i feeling quite cheerful prest called this morning and explained to me of,D&C 59:15,0.30825198721420166
12076,day writing as much as i could between callers who came to see me mon r,D&C 42:49,0.30824982663366385
12103,office till pm amp went home fri at the office feeling fairly well recd a letter,D&C 107:68,0.3080176166539513
12085,bishop called in the morning concerning the rexburgh mill we gave him an order of to,Alma 56:41,0.307901989708415
12093,drove to the office was quite busy feeling very well wed i am feeling well and,1 Ne. 8:31,0.3078821293275195
12090,dressed amp had breakfast at a m amp of the grand children accompanied me to to,1 Ne. 8:5,0.3078258181665807
12173,altar i addressed them as follows you are now husband and wife having entered into this,D&C 74:1,0.3075125961214905
12216,testimony i followed them amp spoke minutes followed by president i spent the day in the,Mosiah 23:30,0.3073263275853177
12094,at oclock fell down the elevator shaft on his head he is very much injured tues,D&C 28:6,0.3069008706472531
12125,tired thur st at the office rec letter from busy at my desk amp had letter,D&C 44:1,0.30689113449305644
12173,where your trouble lies we have them to contend wi in this city and this territory,Alma 42:29,0.30659582940675045
12072,by bro per bro which i signed as prest of the church also in my personal,D&C 20:84,0.30658394545349926
12090,a few oysters wi cracker amp butter for my supper and enjoyed them after going to,2 Ne. 17:22,0.3065763230585258
12146,a few reks amp elder angus munn cannon angus m cannon offered the benediction i did,D&C 59:11,0.306321775377895
12123,drove to the office for a few minutes then attended the annual conference of the church,D&C 123:14,0.30616160652738045
12133,them tomorrow evening i went home at pm amp started ion their trip to this evening,Alma 34:21,0.3059594306872989
12093,in the afternoon to transact some business of the electric power company and he returned to,D&C 76:100,0.3050305480798203
12184,this morning bro waited on me after breakfast we all went to the meeting house the,1 Ne. 3:23,0.3047806255676804
12120,be glad to have him go wi me it was thought i would get along all,Hel. 13:7,0.3046814949840304
12087,carnation to each one present wi a request to have it pressed in commemmoration of this,Mosiah 28:8,0.3046579252708411
12082,of my sealing to my wife by pres being nd i am preparing to do some,D&C 76:100,0.3043114255565393
12216,two hours in the wi the presidency amp twelve prayed mou prest was quite poorly to,D&C 94:3,0.30385606516393937
12112,i staid home to day and rested i spent the day at home mon thwent to,D&C 19:36,0.3038197200229723
12087,from the east last night and made his report to me this morning i wrote to,Omni 1:9,0.30335008368274197
12142,figures i received a letter from to father amp i wrote to owen pages and to,Alma 54:15,0.3032563729853341
12133,conveyance for them amp bro from price to the wells i drove to the office we,2 Ne. 22:3,0.3030588680994982
12177,of his sickness amp elders bateman amp wilcken as occasion required arranged to take charge of,D&C 124:87,0.30299841581169684
12075,i went to and spent the night and attended the celebration of years riag there was,Hel. 14:4,0.302979301731801
12127,charge of alice she had a fairly good night but much pain in her head at,D&C 28:6,0.3028166832076607
12178,i had an interview this morning wi mr farr i received a telegram from we met,Alma 56:41,0.3027341791998845
12236,mr dooly who informed us that men in the east were trying to injure our credit,Alma 56:35,0.30247006807813787
12146,at am my wife amp son returned at oclock from having had an enjoyable visit i,Alma 8:1,0.302370440757358
12129,i was the stest man he ever saw of my age wed i got my rubbing,Hel. 7:14,0.30182448310500865
12177,yet without satisfactory results the remains having been put into as good a condition as possible,D&C 111:11,0.30172540218511096
12208,day and observed thanks giving day a general holiday fri i went to the office this,Mosiah 18:23,0.30163206613222177
12095,are full of darkness and lies i never saw such a time in politics in this,3 Ne. 13:23,0.3009840431190328
12118,girls went to the catholic meeting five of prest children arrived to day to accompany us,Alma 24:22,0.3009138516009514
12148,opinion of experts this terminate his mission he is not sensible at this time the attack,D&C 71:3,0.30085616028906487
12189,i also wrote amp a letter i met in the morning wi the board of the,Omni 1:9,0.3004470893743386
12077,hotel belvedere we wrote home also sent telegram to pres we took a walk and finding,D&C 10:19,0.3004403783922265
12086,trust co for hours the consideration of closing the was herd and ided to close it,3 Ne. 8:19,0.30042254200695034
12244,returned to miles figure i received a letter from to his amp one to we received,D&C 76:74,0.30006212530232595
12146,this afternoon amp evening thur at the office this morning and attended my meeting at the,Alma 34:21,0.2997731235687627
12178,administerd to her but she was bloated to a terrible extent wife of died at oclock,Ether 8:11,0.2995087946428093
12197,pres cannon mins sang o come let us sing benediction by we took dinner at bro,Alma 26:8,0.2994708588392945
12086,i attended a meeting wi the executive committee of z s b amp t co at,D&C 123:14,0.29899235479762204
12082,the office feeling well i drove to at pm to see the school children gathered there,D&C 97:3,0.2989827190367562
12208,some brandy elder got off at and arranged for our carriges to meet us at the,D&C 76:100,0.2989049729284263
12148,and all the congregation came and shook hands wi us we had an excellent time we,Hel. 9:14,0.29888523754354707
12117,better this morning have been closely engaged wi prests amp on financial matters during the morning,D&C 112:5,0.2988850519418426
12132,nephi mints and prest mins he read from the chapter of mosiah sang benediction by drove,Mosiah 25:5,0.29871434506796396
12197,stake followed by bp of scipio ward pres spoke minutes and i followed for mints amp,Mosiah 23:30,0.29836952710937026
12087,what i had said of the action of the presidency amp twelve an interesting conversation then,D&C 94:3,0.2981733394643538
12127,alice twice amp elder once bro nuttall came and staid wi me amp family to night,2 Ne. 5:6,0.2979706999024034
12165,the salt lake stake presidency and undertaker took charge of the body and the procession,3 Ne. 12:13,0.2977268437023422
12167,sent it wi one from is quite poorly i met wi just returned from the east,D&C 44:1,0.29765525551816663
12148,was very sudden suppressed urine the cause his advanced age against him this caused much excitement,Alma 1:23,0.29756035855410035
12132,spoke mints sang benediction by i then drove home drove to the office for a short,Mosiah 21:8,0.2970867800995531
12146,at home to day amp looked about the premises sun at home all day taking my,D&C 30:4,0.2965496196949738
12177,time the body was in a condition that notwithstanding all was done to make the face,D&C 84:28,0.29622998422039115
12197,amp c prayer by bp sang come we that love the lord pres hinckley reported the,D&C 138:24,0.2961854316142722
12244,took carrs amp rode to amp spent the night wi the family of president who lay,D&C 102:9,0.29615157899559047
12085,great convention in the to day the salt lake herrald is publishing lies against the presidency,3 Ne. 12:13,0.2961207315869453
12184,as the church farm amp back to bro pratts for the night sun st all well,Mosiah 22:6,0.29601413318730463
12177,church the casket was borne to the hearse and the cortege left the at am thousands,Alma 23:5,0.29596700937159015
12163,my meeting at am till pm afterwards at the office i am feeling well today fri,2 Ne. 27:23,0.2956325997568393
12236,mr president of the u p rail road he is a good man we met wi,D&C 102:9,0.29558505385424216
12189,deserett national figure i wrote a letter to amp sent one from wi it i met,Alma 54:4,0.29549296186963275
12203,i spent the day in the office i met wi the board of zcmi meeting lasted,Alma 27:16,0.29516498961299714
12167,priesthood without being ordained to that office we also had up the subject of the leader,Alma 13:8,0.2951093550260124
12145,geo w mc cune amp returned missionaries from spoke of the necessity of raising funds to,D&C 72:10,0.2950976790944005
12127,and walked quickly away wi a sneering lh on polly coming in amp telling this amp,D&C 39:24,0.2950875216438114
12077,portland to mt tabor then got ready to leave after supper we went on buss at,D&C 65:3,0.29490858526835406
12111,o box b salt lake city utah st book to to to r s to to,3 Ne. 12:13,0.29471867183523537
12127,still very sick having very severe spells of pain amp choking amp family are about worn,D&C 97:18,0.29411056602965746
12123,minutes the choir amp congregation sang we thank the o god for a prophet pres geo,Alma 31:18,0.29403843518832384
12167,of the quire we finally voted to give him dollars a year for all his time,D&C 104:73,0.29368768900234
12099,all of whom were approved amp were voted for as apostles and as one of the,D&C 72:22,0.2936023369666715
12146,were the speakers a quartette furnished the singing services were conducted by bp who also made,D&C 93:10,0.2930269216969283
12112,the office had a meeting wi the officers of the utah loan and trust co all,D&C 104:84,0.2930224644204484
12112,at the at am till p m i wrote to mm went home at pm fri,3 Ne. 15:14,0.2927877342569002
12093,to for a family reunion thurs at the office i recd a letter from m mountford,D&C 44:1,0.2927551754412734
12077,pm to depot and started on car lodi at pm and soon went to bed fri,Mosiah 7:3,0.29262505815205564
12093,the current business i also attended my usual meeting at the at am afterwards at the,Ether 4:9,0.2922259346012857
12127,letter from everybody doing all they can for alice i had a tolerable fair night is,Alma 9:15,0.2921620297236733
12095,brother arived from to our house he had been laboring wi in germany he is stoping,D&C 88:130,0.29209102649069013
12116,of the first presidency apostles pres of seventies patriarchs prest of stakes amp counselors amp bishops,D&C 107:79,0.2920710893391403
12184,amp surveyor in a special car we arrived at at am and remained in the car,2 Ne. 2:22,0.2918825100714377
12146,well i attended a meeting wi some of the directors of zsbt co wi the officers,D&C 76:100,0.2918516959399047
12163,ap this is arbor day and a general holiday i staid at home sat ap i,D&C 128:4,0.2918480757446021
12096,most of the time bro accompanied me to the office we attended a meeting of the,D&C 123:14,0.29178208495640884
12098,the institution i met wi my councillors amp the twelve upon the matters we were called,D&C 18:27,0.2917353495828076
12146,of the utah loan amp trust company in endeavoring to make some arrang ments in their,D&C 104:84,0.2917188814496548
12184,meeting of the directors of z s b amp t co at pm also a meeting,D&C 62:4,0.2914538744072592
12085,a letter from to his spent the day in the office the democrats are having a,D&C 44:1,0.2910826539451511
12129,we took cars and rode to the wharf to take a ride on the steamer but,Alma 14:4,0.2910459609577851
12118,day each for room and board i spent the day in my room reading the four,D&C 101:21,0.2910401685386603
12145,prayer by bro sang bishop read the tithing reports amp spoke mnts pres geo q cannon,D&C 119:3,0.2910292181549238
12095,figure i wrote a letter to to day of pages i spent the day in the,Omni 1:9,0.29094528699569805
12094,i did not sleep well last night but slept well this morning i wrote to busy,Mosiah 24:19,0.2908562549368945
12173,the faithful saints receive their resurrected bodies they will occupy a place in the celestial kingdom,D&C 88:28,0.29060286447974415
12112,office i called bro in amp told him of my contemplated trip to wi pres for,D&C 124:43,0.2905091642924864
12197,and pres geo q cannon mits sang the lord is risen benediction by bro all went,D&C 138:24,0.2902376117012462
12095,furnished the dinner he is a vary wealthy man amp deeply interested in affairs the young,Mosiah 27:7,0.29019514385753803
12096,written to my wife at enclosing newtons letter to her i also signed my official bond,D&C 20:84,0.2901498578236629
12120,said it would give him pleasure to do so as he had fears in my behalf,1 Ne. 4:37,0.2899356198211076
12079,which i drank wi a relish i read some and went to bed early slept fairly,D&C 76:100,0.2897540208364904
12109,of the committee to inquire into the affairs of the ogden loan amp trust co which,D&C 94:15,0.28964294662150103
12090,again handed the grand children cents each went to bed early and slept fairly well slept,Ether 15:20,0.2895757287580335
12092,f m lyman benediction by elder l b young p m prayer by elder e partridge,D&C 21:11,0.289556798437895
12153,i brought bishop lbs to fill the cars at making lbs which we donate as a,D&C 72:9,0.28940972255624947
12148,were present it was a very interesting meeting myself col amp mrs attended the mormon meeting,Alma 27:16,0.289188244658025
12116,amp high counselors at am sang prayer by bp sang spoke mnt min myself min l,D&C 138:24,0.2891799215287594
12127,at the wi my counselors amp the apostles i am able to partake of more nourishment,D&C 124:142,0.28907735502986875
12208,go to the office today staid at home amp rested thus i staid at home to,D&C 19:36,0.2890473031408144
12073,we met wi sterling mine company we held a meeting also wi the board of the,D&C 10:19,0.28900258462947703
12173,have learned to resist them in the flesh this evening we had a riage reception at,2 Ne. 27:19,0.28890760259104886
12132,to the office bro attended to me i signed some recommends for bro amp his wives,D&C 76:100,0.2888013373911208
12103,from which bro read for me he is in have been very busy today went home,Morm. 9:9,0.288655048936862
12086,quite unmwell wi chills amp fever and kept the family busy much of the time bro,D&C 52:34,0.2885468208932013
12083,nd i rested amp slept well nearly all the past night i requested bro,Ether 15:20,0.28847387513342954
12087,them in any place until after they were made public by action of myself amp the,Ether 12:18,0.28841115258324523
12095,wi us while he stays here i took supper wi my councillors and mr lampson who,D&C 58:9,0.28840694179904336
12087,and in the morning a revelation which i wrote and afterwards sent a copy to president,D&C 102:9,0.28833481964166424
12086,pleased to greet us he also had some papers which needed my signature this i attended,D&C 76:100,0.2881817456659906
12153,the poor and myself met wi the twelve in the and the subject figure of was,1 Ne. 12:9,0.28816140796817546
12090,after breakfast we prepared for a days outing in we arrived at pleasant valley at weather,1 Ne. 18:23,0.28810902681289974
12203,good deal done a good deal of business figure i received a letter from and answered,D&C 111:6,0.2879461042505119
12132,john william hess john w hess sang elders spoke mints mints amp read from chapter rd,D&C 77:5,0.2878736529509435
12165,at salt lake city at a m thousands of people were at the depot jelder of,Hel. 9:11,0.28782632754710075
12189,about our affairs in i received a letter figures from amp i wrote him a letter,D&C 44:1,0.2878024295449287
12083,and examine my wife home thewhich needs some repairs amp her house fixing up and for,D&C 76:100,0.2875767168136432
12099,office then to the at a m conference prayer by spoke min mn min mn mn,D&C 29:10,0.2874806019320977
12097,portland multnomah county oregon port land hotel at a day for our rooms all the company,D&C 124:145,0.2873304302212169
12167,i met wi the twelve in the at oclok and attended to the business before us,D&C 123:14,0.28706306253251734
12142,at the school he returned at noon i spent the afternoon wi him figure i received,1 Ne. 1:9,0.28700077191980417
12075,today on the advice of my counselors to go to the coast to a lower altitude,D&C 124:142,0.28699949891489496
12103,work finished this evening sun we returned to the this morning found all well at home,Alma 34:21,0.28689469639065457
12133,regard to furnishing or to the deseret amp salt lake agricultural amp manufacturing canal co to,3 Ne. 12:13,0.28682990100263567
12097,victoria and went to the and took up our abode there it was quite cold,1 Ne. 3:9,0.28679205359506765
12103,mon this is observed as a general holaday i staid at home tues i went to,D&C 128:4,0.28673500321248596
12132,home thur called at the office and then to the for conference at am the choir,1 Ne. 20:12,0.28671117795165574
12073,went to the wi twelve i spent the day at the office and attended to the,D&C 123:14,0.2865890825930243
12103,thur drove to the office and attended my meeting at the at am afterwards at the,Ether 4:9,0.2864328921307964
12095,attended to what business we had we still have trouble wi debts and the political elements,D&C 104:78,0.2856519423258852
